title,link,image,author,discount,publisher,pubdate,isbn,description
누구나 파이썬 통계분석 (통계는 4차 산업혁명 시대의 필수 지식 / 기초이론-수식-파이썬의 3 STEP),https://search.shopping.naver.com/book/catalog/32472707426,https://shopping-phinf.pstatic.net/main_3247270/32472707426.20221227210106.jpg,타니아이 히로키,23400,한빛아카데미,20200406,9791156644880,"‘누구나’ 할 수 있습니다!

통계학에 수식이 많아서 어렵다고요?
파이썬을 활용하면 복잡한 수식이 없이도 통계분석을 할 수 있습니다!
책을 따라 실습하다 보면 어느새 통계분석을 하는 자신을 발견하게 됩니다.

이런 분들이 보면 더 좋습니다.
■ 파이썬을 사용해 통계분석을 공부하고 싶다.
■ 파이썬의 기초는 배웠지만, 이어서 공부할 내용을 찾지 못했다.
■ 통계분석에 흥미가 있다.
■ 통계 공부를 시작했지만 큰 그림을 볼 수 없다.
■ 머신러닝과 딥러닝을 위해, 기초부터 데이터 분석을 공부하고 싶다."
"2025 시대에듀 파이썬 한권으로 끝내기 : 데이터분석전문가(ADP) + 빅데이터분석기사 실기대비 (국가공인/국가기술 자격, 파이썬의 기초부터 심화까지 모두 잡는 핵심요약, 실제 출제경향을 반영한 기출동형 모의고사 7회분)",https://search.shopping.naver.com/book/catalog/53686291569,https://shopping-phinf.pstatic.net/main_5368629/53686291569.20250322071221.jpg,데싸라면^빨간색 물고기^자투리코드,27900,시대에듀(시대고시기획),,9791138390118,"한 권으로 데이터분석전문가는 물론 빅데이터분석기사 취득까지 한 번에!

시대에듀와 함께 데이터분석 자격시험 합격에 도전하세요!



1. 주도적인 학습을 돕는 시험 대비 노하우 수록

시험을 처음 준비하는 수험생도, 전공자가 아닌 수험생도 시험에 대한 정보를 한눈에 파악할 수 있도록 최신 시험의 출제경향을 분석하여 정리하였습니다. 또한, 작업 유형별 유의사항을 구체적으로 안내하여 시험 응시 시 반드시 준수해야 하는 사항이나 감점 요소 등을 꼼꼼하게 인지하도록 돕습니다. 



2. 탄탄한 기초 학습을 돕는 핵심이론

필수적으로 학습해야 하는 중요 개념과 이론들을 출제유형에 맞춰 수록하였습니다. 시험을 준비하는 누구나 다양한 함수나 복잡한 작업 과정을 능숙하게 익힐 수 있도록 파이썬의 기초부터 심화까지의 핵심이론을 친절하게 설명합니다. 체계적으로 정리한 표, 이해를 돕는 그림과 함께 기초부터 탄탄하게 학습하세요. 초보자도 쉽게 코드를 읽을 수 있도록 전면 컬러로 구성하여 보다 쉽게 이해할 수 있습니다.



3. 최신 출제경향을 담은 기출동형 모의고사 7회분

기본기를 다진 후에는 최신 기출동형 모의고사 7회분을 하나씩 풀어보며 실력을 꼼꼼하게 점검해 보세요. 상세한 해설을 통해 작업 과정을 잘 따라 하고 있는지, 제시된 요구사항에서 빠뜨린 부분은 없는지 정확하게 점검하고 틀린 부분을 빠르게 바로잡을 수 있습니다. 데이터분석전문가, 빅데이터분석기사 실제 합격자인 저자의 실전 Tip과 함께 작업 유형별 특성이나 필수적으로 숙지가 필요한 부분을 내 것으로 만드세요."
"엑셀 × 파이썬 업무 자동화 (매크로, VBA는 이제 낡았다!)",https://search.shopping.naver.com/book/catalog/32436014632,https://shopping-phinf.pstatic.net/main_3243601/32436014632.20221019123515.jpg,카네히로 카즈미,16200,인사이트,20201203,9788966262847,"매크로, VBA는 이제 낡았다!
- 2020년 일본 아마존 IT 분야 최고의 베스트셀러 -

이 책은 업무에서 가장 많이 사용하는 엑셀을 파이썬으로 자동화하는 법을 매우 친절하게 알려주는 책이다. 그동안 엑셀을 자동화하는 도구로 매크로와 VBA를 주로 사용했지만, 이를 활용하는 사람은 소수에 불과했다. 이제 누구나 쉽게 배울 수 있고, 확장성도 뛰어난 파이썬으로 회사 업무에 활력을 불어넣자.

이 책의 특징
1. 반복 업무만 줄여도 업무 시간을 반으로
반복적인 엑셀 수작업을 파이썬으로 순식간에 처리하는 법을 터득할 것이다.
2. 프로그래밍이 두려운 사람도 도전 가능
엑셀 업무에 꼭 필요한 프로그래밍 위주로 파이썬을 빠르게 터득할 수 있다.
3. 실제 업무에 자주 사용하는 엑셀의 핵심 기술을 상세히
업무에 바로 적용할 수 있는 필수 기능 위주로 설명되어 이해도 적용도 쉽다.

이 책의 업무 자동화 기술 6가지
1. 통합문서, 워크시트, 셀 같은 엑셀의 핵심 구조 자동 제어
2. CSV, XLSX와 같은 범용 데이터 파일을 자유자재로 읽고 쓰기
3. 엑셀 함수는 물론 피벗 테이블 같은 집계 기능까지 제어
4. 엑셀의 다양한 서식은 물론 조건부 서식까지 제어
5. 기본 차트에서 버블 차트까지 7가지 엑셀 차트 제작하기 
6. 서식 설정하여 다양하게 공유, 전송할 수 있는 PDF 제작"
Pandas Cookbook 2/e (파이썬 데이터 과학 기초),https://search.shopping.naver.com/book/catalog/32505794053,https://shopping-phinf.pstatic.net/main_3250579/32505794053.20221229073232.jpg,매트 해리슨^시어도어 페트로우,31800,에이콘출판,20201229,9791161754840,"pandas의 모든 기능을 친절한 예제와 설명, 실제 파이썬 코드를 통한 실습과 함께 설명한다. pandas의 핵심 DataFrame과 Series를 주축으로 함수, 메서드, 속성을 설명하고 장단점은 물론 메모리 사용량과 처리 시간도 비교한다. 



금융 데이터에서 가장 중요한 시계열 자료를 처리하는 다양한 방법과 SQL 데이터베이스에 연결하는 방법도 알려준다. 한편 pandas 라이브러리의 그룹화 함수를 체인 기능과 집계함수를 결합해 사용할 때 pandas 라이브러리의 강력한 힘을 느낄 수 있다.



그리고 정돈된 데이터(tidy data)의 정의와 함께 데이터 정돈 방법과 절차를 자세히 알아보고 matplotlib, python plot, seaborn을 이용한 데이터 시각화와 각각의 장단점을 상세히 설명한다."
파이썬 코딩 실습(기본편),https://search.shopping.naver.com/book/catalog/32460058818,https://shopping-phinf.pstatic.net/main_3246005/32460058818.20230919123120.jpg,류지훈^박훈영^시호연^심성보,22500,좋은땅,20200727,9791165366407,"파이썬은 문법이 쉽고 간결해 접근 장벽이 낮아서 학습용으로 적합하며 오픈 소스 개발 언어이기 때문에 무료로 제공하고 있어 실력 있는 개발자들이 만들어 놓은 훌륭한 패키지들이 많다. 하지만 책들과 영상들을 통해 파이썬을 익힌 후, 정작 분석에 필요한 자료들을 처리하고 표출하고자 하면 예상치 못한 에러를 마주하기 마련이다. 그리고 결국은 해결 방법을 찾기 위해 많은 시간을 보내거나 급한 경우 손에 익숙한 언어로 돌아가게 된다. 이 경험을 바탕으로 『차근차근 파이썬 코딩 실습』 기본편과 연구활용 대기과학편의 저자들은 파이썬을 사용해 기상/기후 분야의 자료를 다루면서 얻은 노하우나 문제 해결 등에 초점을 두어 이를 누구나 쉽게 이해하고 사용할 수 있도록 했기 때문에 여타 책들보다 큰 도움이 될 것이다."
마이크로 파이썬으로 만드는 스마트 자동차,https://search.shopping.naver.com/book/catalog/53214449371,https://shopping-phinf.pstatic.net/main_5321444/53214449371.20250226094416.jpg,장문철,19800,먼슬리북스,20250220,9791199093119,"이 책은 마이크로파이썬과 센서를 활용한 자동차 제작과 자율주행 구현을 위한 실습 중심의 가이드입니다. 자동차 조립부터 기본 기능 구현, 블루투스 및 WiFi 통신 활용, 다양한 자율주행 기술까지 단계별로 배울 수 있도록 구성되었습니다. 초보자도 쉽게 따라 할 수 있는 설명과 풍부한 실습 예제를 통해, 하드웨어와 소프트웨어를 결합한 창의적인 프로젝트를 완성할 수 있습니다.

이 책의 특징
1. 실습 중심 구성코드 예제와 함께 하드웨어를 직접 조립하고 테스트하며 배우는 과정이 담겨 있습니다.
2. 초보자 친화적 설명마이크로파이썬과 IoT 개발에 대한 사전 지식이 없어도 쉽게 따라할 수 있도록 친절히 설명합니다.
3. 다양한 센서와 통신 기술 활용최신 IoT 기술과 하드웨어 센서를 활용한 실제 프로젝트를 완성할 수 있습니다.
4. 창의적 프로젝트다양한 센서와 기능을 조합해 자신만의 자동차를 제작하고 응용할 수 있습니다.

이 책은 마이크로파이썬, IoT, 자율주행 기술을 배우고자 하는 초보자와 개발자 모두에게 이상적이며, 이론과 실습의 완벽한 조화를 제공합니다."
파이썬 해킹 프로그래밍 (프로그래머라면 누구나 할 수 있는),https://search.shopping.naver.com/book/catalog/32471462681,https://shopping-phinf.pstatic.net/main_3247146/32471462681.20230523145824.jpg,저스틴 지이츠,22500,에이콘출판,20100104,9788960771161,"해커와 리버스 엔지니어가 읽어야 할 필독서

『파이썬 해킹 프로그래밍』는 파이썬에 대하여 다룬다. 파이썬은 해커와 리버스 엔지니어, 소프트웨어 테스터들이 애용하는 프로그래밍 언어로, 기존의 C/C++보다 원하는 것을 빠르게 개발할 수 있는 장점이 있다. 이 책은 스스로 디버거, 각종 퍼저, 다양한 모니터링 툴 등을 제작해 사용할 수 있도록 돕고 있으며, 이 책에서 사용되는 예제는 조금만 수정하면 실제로 사용할 수 있는 툴이 된다. 어떤 애플리케이션도 다룰 수 있는 소프트웨어 툴을 만들어 내는 능력을 길러보자."
파이썬 디자인 패턴 2/e (디자인 패턴을 사용해 소프트웨어 설계 문제 해결하기),https://search.shopping.naver.com/book/catalog/32473421672,https://shopping-phinf.pstatic.net/main_3247342/32473421672.20221230074135.jpg,체탄 기리다,13500,에이콘출판,20181130,9791161752440,"소프트웨어의 유지보수와 확장성을 생각한다면 설계 단계에서 디자인 패턴은 최선의 해결책이다. 이 책에서는 파이썬을 기반으로 GoF가 처음 제시한 대표적인 디자인 패턴을 설명한다. 현업에서 실제로 사용되는 다양한 예제를 보면서 목적에 적합한 디자인 패턴을 선택하고 이를 기반으로 파이썬 코드를 작성해본다.



 이 책에서 설명하는 객체지향의 기본 원리 및 중요 프로그래밍 원칙은 소프트웨어 설계에 매우 유용할 것이다. 디자인 패턴을 기반으로 한 최적화된 소프트웨어 설계는 프로그래밍에서는 빠질 수 없는 필수 요소다."
수학으로 배우는 파이썬 (초등 수학으로 재밌고 쉽게 파이썬 배우기),https://search.shopping.naver.com/book/catalog/32469581497,https://shopping-phinf.pstatic.net/main_3246958/32469581497.20221230071648.jpg,다나카 카즈나리,11700,영진닷컴,20190304,9788931459852,"어렵다고 느꼈던 파이썬 프로그램을
초등 수학으로 간단하고 재미있게 배워봅시다!

최근 초등학생들이 프로그래밍 언어를 배우는 시대가 왔습니다. 또한, IT 입문자들이나 비전공자들에게도 프로그래밍 공부가 확산되고 있습니다. 그중에서도 파이썬은 문법이 다른 언어에 비해 간결하고 생산성이 높아 초보자들이 쉽게 배울 수 있는 언어로 주목 받고 있습니다. 

이 도서는 기본적인 초등 수학을 주제로 파이썬의 기초 문법부터 프로그램 작성 방법을 배울 수 있습니다. ‘프로그래밍도 어렵고, 수학도 어려운데 둘 다 배운다고?’라고 생각하면 큰 오산입니다. 프로그래밍이 뭔지 몰라도, 수학에 자신이 없다고 해도 전혀 상관이 없습니다. 

프로그래밍에 대해 전혀 모르는 경민이가 공학부 전공자인 “윤정 선배”에게 초등 수학을 주제로 여러 파이썬 프로그램 문제를 풀어나가는 내용으로 구성되었습니다. 초등학교 때 배우는 사칙연산(덧셈, 뺄셈, 곱셈, 나눗셈) 계산 방법을 알고리즘으로 정리하고, 알아보기 쉽게 플로차트로 그리는 방법을 소개합니다. 각 챕터마다 윤정 선배가 내는 숙제를 통해 배운 내용을 복습할 수도 있습니다. 여러 문제를 풀다 보면 자연스럽게 수학도 익히고, 파이썬 프로그램 작성하는 능력도 향상시킬 수 있습니다."
파이썬 프로그래밍 핵심,https://search.shopping.naver.com/book/catalog/32462633619,https://shopping-phinf.pstatic.net/main_3246263/32462633619.20221229072549.jpg,전희성,11700,UUP,20210223,9788978689847,▶ 이 책은 파이썬 프로그래밍 핵심에 대해 다룬 도서입니다. 파이썬 프로그래밍 핵심에 대한 기초적이고 전반적인 내용을 확인할 수 있도록 구성했습니다.
파이썬과 수치 해석 2/e (파이썬 수치 해석 레시피),https://search.shopping.naver.com/book/catalog/32436121332,https://shopping-phinf.pstatic.net/main_3243612/32436121332.20221229073127.jpg,로버트 요한슨,45000,에이콘출판,20190830,9791161753324,"Python을 사용해 과학과 공학 분야에 빈번히 등장하는 연산 문제를 해결하는 방법을 설명한다. Python 과학 연산 모듈인 Scipy, 배열처리 기본 모듈인 NumPy, 데이터 처리를 위한 기본 모듈인 Pandas, 머신 러닝을 위한 Scikit-learn을 중심으로 과학 연산을 처리할 수 있는 두 가지 중요한 기법인 기호적, 수치적 처리 기법을 사용하는 데 Python을 어떻게 활용할 수 있는지 자세히 설명한다.
행렬 및 희소 행렬, 벡터, 상미분과 편미분, 적분, 인수분해, 시계열, 선형 대수, 통계 모델링, 머신 러닝, 신호처리 등 이공계의 대표적 문제들을 해결하는 데 Python을 어떻게 활용할 수 있는지 풍부한 예제를 통해 상세히 설명한다. 
책 후반부는 HDF5를 포함해 데이터 처리를 위한 다양한 파일 입출력 형식을 알아보고, 코드의 실행 성능 향상을 위한 코드 최적화와 함께 모듈 설치법도 상세히 설명한다."
파이썬과 피지컬 컴퓨팅,https://search.shopping.naver.com/book/catalog/32466688663,https://shopping-phinf.pstatic.net/main_3246668/32466688663.20240911071719.jpg,목원대학교 스톡스대학 SW교양학부^구진희,12600,인피니티북스,20200824,9791185578705,"파이썬 프로그래밍과 피지컬 컴퓨팅 구현을 한 권의 책으로!

이 교재는 두 개의 파트로 구성되어 있다.
Part 01 파이썬 프로그래밍을 위한 기초 문법에서부터 파일 읽고 쓰기와 라이브러리 활용하기까지 다양한 실습 예제와 이해한 내용을 확인하기 위한 연습문제와 응용문제가 마련되어 있다.
Part 02 아두이노를 이용하여 피지컬 컴퓨팅 구현을 위한 기본적인 센서와 부품을 사용하며 실습 예제를 따라하는 과정에서 자연스럽게 아두이노를 익히도록 하였다. 그리고 응용 예제를 통해 추가 부품들을 사용하여 기능을 확장하도록 하였다."
파이썬 네트워크 자동화 (가상화 랩 만들기를 통한),https://search.shopping.naver.com/book/catalog/32445226148,https://shopping-phinf.pstatic.net/main_3244522/32445226148.20221227204704.jpg,최병철,40500,에이콘출판,20190725,9791161753188,"저자의 풍부한 실무 경험을 바탕으로 현 IT 업계에 네트워크 또는 시스템 엔지니어로 종사하는 분들 그리고 미래 네트워크 엔지니어를 꿈꾸는 학생 및 취업 준비생을 위해 쓰여졌습니다. 현업에서 프로그래밍 언어 중 하나인 파이썬(Python)을 이용해 네트워크 자동화를 구현하고자 하는 네트워크 엔지니어에게 실용적, 구체적, 기초적인 지식을 소개합니다. 이 책을 통해 파이썬 3와 여러 가지 IT 기술을 접목시킨 가상화 네트워킹 랩 만들기를 통해 네트워크 자동화의 초석이 되는 기본기를 배울 수 있을 것입니다."
신비한 파이썬 프로젝트 (호기심을 풀어보는),https://search.shopping.naver.com/book/catalog/32477572007,https://shopping-phinf.pstatic.net/main_3247757/32477572007.20230711113133.jpg,리본,21600,영진닷컴,20200522,9788931462081,"당신의 호기심을 풀어보는 신비한 파이썬 프로젝트

이 책은 다양한 프로젝트로 새로운 파이썬 기술을 익히거나 창의적인 프로그래밍을 배워볼 수 있습니다. 미국 남북전쟁 암호 해독, 외계 화산 시뮬레이션, 대형 금융 거래, 벤포드 법칙을 이용한 사기 탐지 등 다양한 프로젝트를 수행해 보면서 파이썬 라이브러리와 모듈에 관한 지식을 쌓아봅니다. 챕터마다 프로젝트와 소스 코드를 함께 설명하여 쉽게 이해할 수 있도록 도와줍니다. 챕터마다 연습/도전 프로젝트를 제공하고, 연습 프로젝트에는 솔루션이 함께 제공되므로 스스로 실력을 확인해 볼 수 있습니다."
실전 파이썬 프로그래밍 (오픈 소스 개발자가 알려주는 고급 기법과 실천법),https://search.shopping.naver.com/book/catalog/32445099127,https://shopping-phinf.pstatic.net/main_3244509/32445099127.20221019124854.jpg,줄리안 단주,15300,인사이트,20141213,9788966261246,"[실전 파이썬 프로그래밍]은 오랜 기간 다양한 오픈 소스 프로젝트에 참여해 왔고 특히 오픈스택 프로젝트에서 다년간 파이썬으로 개발해 온 지은이 줄리안 단주는 그간의 자신의 경험과 오픈 소스 프로젝트의 좋은 실천법을 바탕으로 이 책에서 메서드와 데코레이터 활용, 모듈과 라이브러리 다루기 같은 내용을 풀어놓고 있다."
구글로 공부하는 파이썬 (구글에서 찾는 파이썬 실전 예제 분석),https://search.shopping.naver.com/book/catalog/32441659094,https://shopping-phinf.pstatic.net/main_3244165/32441659094.20230131165241.jpg,김용재,37800,비제이퍼블릭,20180309,9791186697559,"구글에서 찾는 파이썬 실전 예제 분석

파이썬을 체계적으로 설명한 좋은 강의나 글들이 많지만, 많은 경우 강사나 저자를 통해 잘 정제된 지식의 결과를 따라가는 방식이여서, 시간이 지나면 프로그램의 버전 변경 등으로 내용이 바뀌어 진행이 막히기도 하고, 강의를 따라하면서 새로운 시도를 하다가 책에 설명되어 있지 않은 이해하기 어려운 에러를 만나서 공부할 의욕을 잃어버리기도 합니다.

많은 종류의 파이썬 책에서 체계적인 문법, 좋은 코딩 습관, 프로젝트와 모듈 구성, 유지 보수 등 언어의 구조적 측면에 대해 잘 설명하고 있긴 하지만, 이 책에서는 반대로 만들고 싶은 기능을 선택하고, 모르거나 막히는 부분에 대해 구글을 찾아 헤매며 의도했던 기능을 만들어 가는 과정을 명확하게 보여 주는 방식으로 진행하려 합니다. 각 장에 뒤에는 예제에서 다룬 문법 요소에 대해서 추가적인 설명을 하는 미니문법 섹션이 들어가 있습니다. 그럼 이 책을 통해 여러분들이 좀 더 재미있게 파이썬을 공부하시기를 기원합니다.

이 책의 특징
- 만들고 싶은 기능을 선택하고, 막힐 때마다 구글을 통해 문제를 해결하는 방식으로 진행합니다. 
- 여러 다양한 장르에 대해서 특화된 모듈을 사용하여 파이썬 예제들을 만들어봅니다.
- 예제를 만들어가는 과정에서 자연스럽게 프로그래밍 구성 요소들과 배경 지식, 문법을 익힐 수 있도록 구성했습니다.

이 책이 필요한 독자
- 파이썬으로 할 수 있는 다양한 작업들을 익히고, 업무에서 응용하여 사용하고 싶은 개발자
- 기존 책에 없는 파이썬 최신 정보를 기준으로 누구보다 빠르게 습득하고 싶은 입문자
- 틀에 박힌 설명에서 벗어난 새로운 프로그래밍 강의를 원하는 학생 및 수강생

독자대상
초중급"
"헬로! 파이썬 프로그래밍 (쉽고 재미있게 프로그래밍 배우기, 개정증보판)",https://search.shopping.naver.com/book/catalog/32466831337,https://shopping-phinf.pstatic.net/main_3246683/32466831337.20221231084005.jpg,워렌 산데^카터 산데,24300,위키북스,20150904,9791158390112,"파이썬에 매료된 저자와 그의 아들이 함께 프로그래밍을 배워나가면서 간단한 프로그램부터 그래픽과 사운드가 가미된 게임까지 만드는 과정을 그렸다. 컴퓨터 프로그래밍을 처음 접하는 이들의 눈높이에 맞춰 프로그래밍의 개념과 원리를 친절하고 상세하게 소개함으로써 프로그래밍의 핵심 원리를 단계별로 이해하고, 프로그래밍 언어의 구조와 원리뿐 아니라 문제 해결과 이를 위한 사고 방식을 자연스럽고 체계적으로 익힐 수 있다.



이 책은 전 세계적으로 호평받은 '헬로! 파이썬 프로그래밍'의 개정판으로서, 전면 컬러로 바뀌어 코드를 이해하기가 훨씬 수월해졌다. 그뿐만 아니라 파이썬 2와 파이썬 3의 차이점을 비롯해 개선된 GUI 제작 기법, 딕셔너리, 인공지능 등 다양하고 깊이 있는 내용까지 더해져서 프로그래밍을 처음 시작하는 분들이 기초와 실무를 탄탄히 다지는 데 도움될 것이다."
"파이썬 3.6 프로그래밍 (기초 예제부터 라즈베이 파이, 알렉사, 텔레그램 봇까지 만들면서 배우는)",https://search.shopping.naver.com/book/catalog/32485478774,https://shopping-phinf.pstatic.net/main_3248547/32485478774.20221019115540.jpg,신호철,27000,위키북스,20170718,9791158390716,"『파이썬 3.6 프로그래밍』은 처음 프로그래밍을 시작하는 분들에게 파이썬은 매우 적합한 언어다.  C 나 자바 등의 언어에 비해 매우 배우기 쉽고, 윈도우나 유닉스 등 여러 운영체제에서도 큰 수정 없이 잘 동작한다. 이 책은 기초 문법부터 실생활에 유용하게 활용할 수 있는 실전 예제까지 자세하게 설명하고 있어, 파이썬을 처음 접하는 초보자는 물론 중급 이상의 개발 경험자들에게도 충분히 유용한 책이 될 것이다."
순서도로 배우는 파이썬,https://search.shopping.naver.com/book/catalog/32436121442,https://shopping-phinf.pstatic.net/main_3243612/32436121442.20220527041107.jpg,김종훈,0,다올미디어,20160620,9788997587193,"순서도와 파이썬을 통한 체계적인 소프트웨어 교육으로 문제해결능력 신장을 위한 알고리즘 중심의 내용을 담은 『순서도로 배우는 파이썬』. 순서도를 통해 논리적인 흐름을 이해한 후에 코딩을 하는 교육 방법을 통해 올바른 소프트웨어 교육 방향을 제시한다. 이 책은 주어진 문제를 해결하는 순서도를 먼저 이해하고, 이를 초보자가 가장 쉽게 배울 수 있는 텍스트 기반 언어인 파이썬으로 구현하며, 관련 과제를 스스로 해결해보는 형식으로 이루어져 있다."
파이썬(Python) 3 (쉽고 재미있는 프로그래밍 언어),https://search.shopping.naver.com/book/catalog/32441643782,https://shopping-phinf.pstatic.net/main_3244164/32441643782.20231017082827.jpg,최용,22500,인피니티북스,20140212,9791185578002,"『파이썬(Python) 3』은 쉽고 강력한 프로그래밍 언어인 파이썬에 대한 책이다. 파이썬의 기초, 시쿨리, 안드로이드 환경에서의 파이썬 스크립팅, 파이썬을 사용한 문자열 다루기, 다양한 파이썬 패키지의 소개와 다루는 법, 자이썬 등을 다룬다."
"파이썬 마이크로서비스 (모범 사례로 알아보는 파이썬 마이크로서비스 개발, 테스트, 배포, 확장까지)",https://search.shopping.naver.com/book/catalog/32457314992,https://shopping-phinf.pstatic.net/main_3245731/32457314992.20221230073105.jpg,타렉 지아드,31500,에이콘출판,20190517,9791161752730,"파이썬을 사용해서 마이크로서비스의 설계부터 코딩, 테스트, 배포까지 전반적인 과정을 다룬다. 모질라(Mozilla)에서 파이썬 개발자로 활동하는 저자의 풍부한 경험과 샘플 프로젝트 개발 과정을 따라가면서, 모범 사례와 주의 사항을 배울 수 있다. 또한 파이썬 생태계의 다양한 라이브러리 활용법도 살펴본다."
