title,link,image,author,discount,publisher,pubdate,isbn,description
Do it! 점프 투 파이썬: 라이브러리 예제 편 (실무에 쓰는 라이브러리는 이 책에 다 있다!),https://search.shopping.naver.com/book/catalog/32474234908,https://shopping-phinf.pstatic.net/main_3247423/32474234908.20230313182501.jpg,박응용,23400,이지스퍼블리싱,20220525,9791163033554,"파이썬 분야 1위 도서 《Do it! 점프 투 파이썬》의 후속 편 출간!
다양한 예제로 배우는 파이썬 라이브러리 실전 안내서!

이 책은 《Do it! 점프 투 파이썬》의 박응용 저자가 그동안 수많은 독자에게 받았던 ‘이제 무엇을 공부해야 할까요?’, ‘파이썬으로 무엇을 해볼 수 있을까요?’와 같은 질문에 대한 대답이다. 파이썬의 가장 큰 장점은 여러 분야에 걸쳐 방대한 라이브러리가 이미 만들어져 있다는 것이다. 하지만 어떤 라이브러리가 있는지 모른다면 제대로 쓸 수 없다. 즉, 파이썬 라이브러리 지식이 많을수록 파이썬을 자유자재로 사용할 수 있다. 이 책은 여러분이 파이썬이라는 넓은 바다를 자유롭게 항해할 때 꼭 필요한 나침반이 되고자 한다.
효율적으로 공부할 수 있도록 실무에서 자주 쓰는 파이썬 라이브러리 122개를 엄선했다. 라이브러리마다 스토리가 담긴 예제가 있어 라이브러리를 언제 어떻게 사용해야 하는지 배울 수 있다. 문제를 해결하는 경험을 하나씩 쌓다 보면 파이썬으로 무엇을 할 수 있고, 그중 하고 싶은 게 무엇인지 스스로 깨닫게 될 것이다."
파이썬(Python) 3학년 머신러닝의 구조 (체험으로 배우고! 대화 형식으로 공부!),https://search.shopping.naver.com/book/catalog/42600101625,https://shopping-phinf.pstatic.net/main_4260010/42600101625.20230926084700.jpg,모리 요시나오,16200,성안당,20230920,9788931559231,"인공지능의 부분집합 머신러닝을 알기 쉽게 설명!
머신러닝의 개념과 비교, 실행 방법을 확실하게 잡아주는 똑똑한 입문서

인공지능의 인기로 학습 필요성이 높아진 머신러닝 입문서 『파이썬 3학년』이 출간되었다. 
염소 박사와 다솜 양 같은 동물 캐릭터의 친근한 일러스트와 묻고 답하는 대화형 설명으로 친숙한 『파이썬 1학년』이 출간된 이후 『파이썬 2학년 스크래핑의 구조』, 『파이썬 2학년 데이터 분석 구조』이 니왔고 이번에 『파이썬 3학년 머신러닝의 구조』 편이 나온 것이다. 

 인공지능 머신러닝을 실습해볼 수 있는 데이터세트는 이미 많이 공개되어 있다. 이 책의 장점은 이런 데이터세트를 실행하기 위한 파이썬 라이브러리를 포함하여 설치되는 배포판 아나콘다 설치 방법부터 파이썬 웹 인터프리터인 구글 코랩과 주피터 노트북(주피터랩)으로 누구나 실행할 수 있도록 그림과 설명으로 자세하고 쉽게 안내한다는 점이다.
 
 인공지능과 머신러닝(기계학습)에 대해 이 책의 염소 박사는 이렇게 쉽게 설명한다. 

 “인공지능은 데이터를 ‘입력’하면, 판단이나 예측을 ‘출력’하는 것, 즉 ‘매우 똑똑한 함수’야. 실제로 인공지능은 ‘함수’로 기술되어 있어.”
 “머신러닝은 데이터를 많이 넘겨주면, 컴퓨터가 스스로 학습하는 편리한 방법이야.”  

머신러닝의 주요 개념으로 많이 인용되는 회귀, 분석, 클러스터링 같이 구부하기 어려운 개념도 척척 잡아주고, 파이썬 개발 환경의 차이는 물론이고 예를 들면 ‘분류’를 공부할 때 결정 트리와 랜덤 포레스트를 이용했을 때 정확도 차이 등 개념과 활용 면에서 비교해서 공부하기 어려운 부분을 완전히 이해해서 쉽게 설명하는 디테일이 훌륭하다. 

이 책의 예제 코드(.ipynb 파일들)와 함께 홈페이지 회원들에게만 제공하는 회원특전 PDF는 예제 관련 사이트 링크로 성안당 홈페이지(www.cyber.co.kr)에 회원가입 후 [자료실]-[자료실]에서 도서 검색을 통해 다운로드할 수 있다."
파이써닉한 파이썬을 익히는 간결한 안내서,https://search.shopping.naver.com/book/catalog/33977555620,https://shopping-phinf.pstatic.net/main_3397755/33977555620.20230920072812.jpg,데이비트 M. 비즐리,25200,인사이트,20220822,9788966263653,"군더더기 없는 설명, 간결한 예제로 배우는 
최신 파이썬 프로그래밍 레퍼런스!

이 책의 목표 중 하나는 독자가 ‘파이써닉(Pythonic)’하게 코드를 작성하도록 돕는 것이다. 파이써닉이라 함은 기본적으로 파이썬의 관용 표현에 맞게 프로그래밍한다는 의미이며, 파이썬이 지원하는 컨테이너, 반복 가능 객체, 자원 관리 등과 같은 파이썬 프로토콜을 적극적으로 활용한다는 뜻이기도 하다. 파이썬을 자신의 주요 프로그래밍 언어로 삼고자 한다면, 독자는 이를 사용하기 위해 노력해야 한다.
 《파이써닉한 파이썬을 익히는 간결한 안내서》는 전반부에서 기초적인 파이썬 문법을 쉽고 간결하게 정리하고 있다. 프로그래밍에 대한 약간의 지식만 있다면 전반부 학습만으로도 능히 파이썬의 기본 기능을 쉽고 빠르게 익힐 수 있다. 중반 이후부터는 고급 사용자를 위한 프로토콜, 객체, 제너레이터, 비동기, 모듈과 패키지 등 파이썬 개발에서 핵심이 되는 주제를 심도 있게 다룬다. 
 파이썬 분야의 대가답게 저자는 간결한 예제와 통찰이 돋보이는 설명 그리고 파이써닉한 코드 작성법까지, 파이썬 개발자라면 맞닥뜨리게 될 다양한 문제에 대한 훌륭한 지침을 이 한 권에 담아 제공한다."
코딩 테스트로 시작하는 파이썬 프로그래밍 (25가지 기출문제 상세 코드 & 개념 강화를 위한 연습문제 수록),https://search.shopping.naver.com/book/catalog/32436152173,https://shopping-phinf.pstatic.net/main_3243615/32436152173.20230502162017.jpg,다니엘 진가로,21600,영진닷컴,20220425,9788931466010,"세계 프로그래밍 대회 기출문제로 익히는 파이썬 프로그래밍
프로그래밍 평가 사이트를 활용한 최고의 코딩 학습 

프로그래밍 경진대회에 출제된 흥미로운 문제들을 풀어가는 과정에서 파이썬 핵심 개념과 프로그래밍 기술을 배웁니다. DMOJ, Timus, USACO 프로그래밍 평가 사이트에 실린 문제들로 구성되어 있어, 웹사이트에 솔루션을 제출한 후 그에 대한 피드백을 빠르게 제공받을 수 있습니다.

컴퓨터는 올바른 명령만 주어지면 거의 모든 문제를 해결할 수 있고, 여기에 필요한 것이 프로그래밍입니다. 이 책을 펼치면 초보자도 바로 파이썬 프로그램을 만들어 볼 수 있습니다. 기출문제 설명부터 시작해 문제 해결에 필요한 개념을 배워 나가는 과정에서 파이썬 언어의 특징을 학습하는 동시에 컴퓨팅 사고력을 기를 수 있습니다.

| 학습할 내용
ㆍ 파이썬 코드 실행, 문자열 작업, 변수 사용
ㆍ 결정을 내리는 프로그램 작성
ㆍ while 루프, for 루프를 이용해 효율적인 코드 작성
ㆍ 집합(set), 리스트(list), 딕셔너리(dictionary)로 데이터 구성, 정렬, 검색
ㆍ 함수와 하향식 설계를 사용한 프로그램 디자인
ㆍ 완전 탐색 알고리즘과 Big O 표기법으로 더욱 효율적인 코드 작성

중간중간에 삽입된 객관식 ‘개념 확인’ 문제는 각각의 코드 조각이 어떤 식으로 작동하는지 생각해 보게 만들고, 각 장 마지막에 제시된 다양한 연습문제는 지금까지 배운 개념을 더욱 깊이 탐구할 수 있도록 유도합니다.

* 이 책에 수록된 25가지 기출문제 상세 코드와 개념 강화를 위한 연습문제 풀이 코드는 [영진닷컴 홈페이지]에서 다운로드할 수 있습니다."
쉽게 배우는 AI 프로그래밍 파이썬 프로그래밍 (쉽게 배우는 AI 프로그래밍),https://search.shopping.naver.com/book/catalog/44919615624,https://shopping-phinf.pstatic.net/main_4491961/44919615624.20231230070732.jpg,박상배^윤진원^변선준,18000,일진사,20240115,9788942919130,"본 교재는 파이썬 프로그래밍 언어를 쉽게 배우고 관련 라이브러리와 프레임워크를 알기 쉽게 설명하고자 예제 기반의 파이썬 사용 방법들을 소개하고 있다.

1부. 파이썬을 시작하기에 앞서 소프트웨어가 무엇인지 소개하고 인터프리터 언어와 컴파일러 언어의 차이를 기술하였다.

2부. 파이썬을 시작하기 위한 Tool 설치 방법과 파이썬 언어에 대한 장단점을 서술하였다.

3부. 파이썬 프로그램의 기초 과정을 수록하였다.

4부. 기초 과정 기반으로 파이썬 프로그래밍 중급 과정을 다루었다.

5부. 고급 과정으로 중급 과정에서 다루지 않았던 프로그램 다중처리, GUI 프로그래밍, 파이썬 라이브러리 및 패키지 사용 방법을 다루고 있어 한층 더 높은 레벨의 프로그래밍 기법을 소개하였다."
컴퓨팅 사고와 소프트웨어 with 파이썬,https://search.shopping.naver.com/book/catalog/32492220890,https://shopping-phinf.pstatic.net/main_3249222/32492220890.20230313185907.jpg,성태응^홍정희^이홍래,22500,인피니티북스,20220302,9791185578927,"이 책은 파이썬 언어의 프로그래밍적 역량 강화에 집중하지 않고, 파이썬은 소프트웨어의 이해를 위한 한 가지 종류로써 이를 활용하여 컴퓨팅 사고를 하는 방법을 다룬다. 1~2장에서는 시대적인 특징과 컴퓨터에 대해 간략히 설명하고, 3~5장에서는 컴퓨팅 사고의 정의와 단계에 대해 설명한다. 6~13장에 걸쳐 파이썬 언어의 기초를 설명하고 이를 가지고 14장에서 책 전체를 학습하며 배운 내용들로 컴퓨팅 사고를 통한 문제해결로 자신만의 프로그램을 작성해볼 수 있다."
파이썬을 이용한 딥러닝/강화학습 주식투자 (파이토치와 케라스를 활용한 인공지능 퀀트 투자 시스템),https://search.shopping.naver.com/book/catalog/32466841665,https://shopping-phinf.pstatic.net/main_3246684/32466841665.20250212072144.jpg,퀀티랩,27000,위키북스,20220330,9791158393205,"강화학습은 스스로 학습하는 머신러닝 기법으로서 주식 데이터 학습에 잘 적용되는 기법입니다. 이 책에서는 파이썬을 이용한 강화학습 기반의 주식투자 시뮬레이션 프로그램을 개발하는 방법을 살펴보고, 이를 실전에 활용해 볼 수 있도록 이론과 코드 수준에서 상세한 설명을 덧붙였습니다.

이 책을 통해 딥러닝과 강화학습을 이해하고 이를 바탕으로 주식투자를 비롯한 다양한 도메인에 활용할 수 있을 것입니다.

★ 이 책에서 다루는 내용 ★

◎ 딥러닝과 강화학습 이론
◎ 주식투자에 강화학습을 적용하는 법
◎ 강화학습 기반의 주식투자 시스템 개발
◎ 강화학습을 위한 실제 주식 데이터 획득 및 처리
◎ 강화학습으로 주식 데이터를 학습하는 법
◎ 학습한 강화학습 모델을 활용하는 법
◎ 강화학습 기반의 주식투자 시스템을 커스터마이징하는 법

- 홈페이지: https://wikibook.co.kr/dltradingrev2/
- 예제코드: https://github.com/quantylab/rltrader/tree/v3.0"
파이썬으로 배우는 소프트웨어와 인공지능,https://search.shopping.naver.com/book/catalog/32441652828,https://shopping-phinf.pstatic.net/main_3244165/32441652828.20230509164624.jpg,조행래^윤종희^서영석^김영탁,22500,영남대학교출판부,20220315,9788975818516,"빅데이터와 인공지능, 기계학습, 파이썬 언어 등을 체험하고, 이런 기술들을 자신의 전공 분야에 
접목할 수 있도록 하는 데 중점을 둠

알파고의 등장 이후로 인공지능에 대한 사회적인 관심이 급증하고 있으며, 4차 산업혁명의 발전으로 다양한 산업 분야에서 소프트웨어 기술과의 융합이 이루어지고 있다. 이에 따라 소프트웨어와 인공지능 기술 관련 지식은 컴퓨터공학 전공자만이 아니라 모든 사회 구성원들이 필수적으로 갖추어야 하는 기초 소양이 되었다. 이 책은 4차 산업혁명의 핵심 기술인 빅데이터와 인공지능, 기계학습, 파이썬 언어 등을 체험하게 하고, 이러한 기술들을 자신의 전공 분야에 쉽게 접목할 수 있도록 유도하는 내용으로 구성하였다."
"2022 공개적 빅데이터분석기사 실기 (필수 합격서, 파이썬, 핵심알고리즘 완전 정복)",https://search.shopping.naver.com/book/catalog/32481406692,https://shopping-phinf.pstatic.net/main_3248140/32481406692.20221019135105.jpg,김원표,30600,와이즈인컴퍼니,20220204,9791189507589,"본 도서는 한국데이터산업진흥원에서 실시하는 빅데이터분석기사 국가기술자격 실기시험 대비 도서입니다.

본 교재는 Python을 활용하여 쉽고 빠른 자격증 취득으로 이어질 수 있도록 도움을 줄 것입니다.

최신 개정판에는 단답형 대비 예상문제 및 작업형 예제문제 및 기출문제 풀이를 담아 크게 단답형 및 작업형 대비로 나누었습니다.
단답형 예상문제 및 기출문제, 작업형 대비는 Python과 데이터 다루기, 데이터탐색과 데이터정제, 머신러닝 프로세스, 머신러닝 핵심 알고리즘 총 4부로 구성하였습니다.
 
데이터캠퍼스의 빅데이터 교육은 많은 사람들이 데이터 분석을 쉽게 익히고 활용할 수 있는 기회를 마련하고자 시작되었습니다.
또한 통계 분석ㆍ빅데이터 실무 20년의 전문가 ‘김원표’ 교수의 제대로 된 강의로 기초부터 활용까지 탄탄한 내용을 자랑합니다.
70여개의 대학 연구 기관과 1,000개의 기업, 20,000명의 수강생들을 데이터 분석 전문가로 양성해 낸 데이터캠퍼스의 교육으로
4차 산업 혁명의 시작과 끝인 빅데이터 전문가로 성장해보세요.
합격의 가장 빠른 지름길은 데이터캠퍼스가 정답입니다.

최신개정판에는 단답형 예상문제 및 기출문제 풀이를 담았습니다."
파이썬으로 완성하는 비지도 학습 알고리즘 (비감독 모형과 텐서플로 2를 이용한 전처리 기법의 머신러닝 구현),https://search.shopping.naver.com/book/catalog/32436148151,https://shopping-phinf.pstatic.net/main_3243614/32436148151.20230131164215.jpg,송동근,30600,비제이퍼블릭,20211130,9791165921101,"다양한 비지도 학습 문제들을
이제 실제 파이썬 코드로 구현한다!

실제 이론을 코드로 구현하는 데에는 많은 현실적인 격차가 존재하고, 이론을 완벽히 이해한다고 해도 코드로 구현한다는 건 또 다른 문제이다. 그래서 이 책에서는 비지도 학습의 이론을 간단하게 살펴본 후에 알고리즘의 이론과 수식을 여러 단계로 나누고 파이썬 코드로 단계별 결과들을 최대한 상세하게 다루었다.

또한 텐서플로 2의 오토 인코더와 함께 사용하는 주요 딥러닝 이론들을 실습하고 딥러닝의 활성화 함수, 손실 함수, RNN, CNN, LSTM 등을 소개한다. 마지막으로 다양한 예제 데이터와 함께 그동안 배웠던 이론을 적용하고 머신러닝으로 직접 코딩하면서 결과물을 완성할 수 있도록 했다. 이 책을 통해 여러분도 머신러닝에서 비지도 학습이 갖는 역할을 익혀 나가길 바란다.

이 책의 특징
- 비지도 학습의 이론과 코드의 간격을 줄였다.
- 자신만의 머신러닝 단계를 완성할 수 있다.
- 최대한 해석이 용이한 코드를 사용하였다.

이 책이 필요한 독자
- 파이썬을 데이터 분석에 활용하고자 하는 분
- 비지도 학습에 대해 더 자세히 알고 싶은 분
- 더 높은 수준의 머신러닝 기법이 필요한 분"
응용이 보이는 선형대수학 (파이썬과 함께하는 선형대수학 이론과 응용),https://search.shopping.naver.com/book/catalog/32485538164,https://shopping-phinf.pstatic.net/main_3248553/32485538164.20250222102253.jpg,이건명,28830,한빛아카데미,20200706,9791156645009,"이건명의 『응용이 보이는 선형대수학』은 〈선형대수학의 개요〉, 〈선형방정식〉, 〈행렬〉, 〈역행렬〉 등 파이썬과 함께하는 선형대수학 이론과 응용에 대한 내용이 수록되어 있다."
파이썬 비동기 라이브러리 Asyncio (대규모 병행성 작업을 위한 비동기 프로그래밍),https://search.shopping.naver.com/book/catalog/32436118594,https://shopping-phinf.pstatic.net/main_3243611/32436118594.20250107083336.jpg,케일럽 해팅,16200,한빛미디어,20210501,9791162244197,"비동기 프로그래밍의 지름길 Asyncio

비동기 프로그래밍을 위한 파이썬 라이브러리 Asyncio를 다루는 실용서다. 대규모 동시성 작업과 높은 안전을 보장하는 Asyncio를 다양한 사례로 소개한다. 예제를 통해 파이썬의 기존 방식과 새로운 비동기 방식의 차이점을 실용적인 관점에서 설명하고 async/await 언어의 새로 도입된 문법과 Asyncio와 호환되는 인기 있는 라이브러리를 소개한다."
파이썬 딥러닝으로 시작하는 이상 징후 탐지 (한국어판),https://search.shopping.naver.com/book/catalog/32494093242,https://shopping-phinf.pstatic.net/main_3249409/32494093242.20230801121402.jpg,Sridhar Alla^Suman Kalyan Adari,35150,홍릉,20210924,9791156008781,이 책은 파이썬 딥러닝으로 시작하는 이상 징후 탐지에 대해 다룬 도서입니다. 기초적이고 전반적인 내용을 확인할 수 있도록 구성했습니다.
창의적 문제 해결을 위한 파이썬 프로그래밍,https://search.shopping.naver.com/book/catalog/32461135864,https://shopping-phinf.pstatic.net/main_3246113/32461135864.20221228074010.jpg,김진일^윤장혁,20700,연두에디션,20200210,9791188831395,"파이썬을 처음 접하거나 다른 프로그래밍 언어에 대한 경험이 아직 많지 않은 초보자를 위한 입문서이다. 책의 1부는 ‘컴퓨팅 사고력과 파이썬 기초’이며 파이썬에 대한 기본적인 내용을 다루었다. 2부는 ‘분야별 문제 해결 및 파이썬 활용’이며 파이썬을 이용하여 STEAM 분야의 문제 해결 및 프로그래밍 활용 내용을 다루었다. 책의 1부를 통해 기초적인 파이썬 프로그래밍을 익히고, 2부를 통해 STEAM 분야의 문제 해결을 위한 컴퓨팅 사고력 향상을 이룰 수 있도록 책의 내용을 구성하였다."
엑셀과 비교하며 배우는 파이썬 데이터 분석,https://search.shopping.naver.com/book/catalog/32475038709,https://shopping-phinf.pstatic.net/main_3247503/32475038709.20250401091437.jpg,장쥔홍,21600,제이펍,20210617,9791191600117,"중국에서 각종 우수 도서상을 수상하고 베스트셀러로 판매되고 있는, 데이터 분석을 위한 최고의 한 권!

이 책은 데이터 분석의 전체 프로세스를 체계적으로 학습할 수 있는 실습서이자 데이터 분석가에게는 꼭 필요한 실전 도구로서 만들어졌습니다. 어떠한 데이터이든지 처리하고 정리하여 일목요연하게 파악하기 쉽도록 만들어주는 최고의 툴인 엑셀과 파이썬을, 둘 중 어느 것도 놓치지 않고 두 도구의 장점만을 취해 데이터 처리와 분석을 효과적으로 쉽게 해낼 수 있도록 해줍니다. 이 책과 함께라면 데이터를 다루는 그 어떤 업무에서도 빠르고 효율적으로 성과를 낼 수 있을 것입니다."
Hello Coding 한입에 쏙 파이썬 (크리에이터 김왼손의 쉽고 빠른 파이썬 강의),https://search.shopping.naver.com/book/catalog/32486946625,https://shopping-phinf.pstatic.net/main_3248694/32486946625.20230408104148.jpg,김왼손^김태간,13500,한빛미디어,20180620,9791162240854,"프로그래밍이 처음인가요? 혹은 프.포.자(프로그래밍을 포기한 사람)인가요? 여기 100만이 이미 검증한 파이썬 입문서가 있습니다. 유튜브와 유데미를 통해 강의한 엑기스를 모아 담은 이 책을 펼치면 프포자도, 처음 프로그래밍을 배우는 사람도 파이썬을 쉽게 배울 수 있습니다.
지루한 이론으로 그치지 않고 중간중간 앨리스 스토리를 넣어 어떤 상황에 어떻게 코드를 적용하는지 보여줍니다. 누구나 쉽게, 모두를 위한 파이썬 입문서, 으로 이제 파이썬의 세계에 빠져보세요!

 
헬로 코딩 시리즈로 초보에서 탈출했다고 끝내거나 멈추지 마세요. 좀 더 깊이 있게 파이썬을 배우면 웹페이지를 만들거나 데이터 분석을 하거나 인공지능을 학습할 수도 있습니다. Hello Coding 시리즈는 프로그래밍을 시작하는 독자의 ‘첫’ 걸음을 응원합니다.
 

프로그래밍을 이제 막 시작하려는 분. 프로그래밍을 한 번도 해본 적이 없는 분. 프로그래밍이란 게 뭔지 한입 맛보고 싶은 분. 프로그래머를 꿈꾸는 분. 취미나 교양으로 배워보고 싶은 분. 아무리 열심히 해봐도 도저히 어려운 분. 반복되는 포기로 이제는 미워지려고 하는 분. 엔트리, 스크래치 다음 단계로 본격적으로 배워 보고 싶은 분. 데이터 분석 등을 학습하기 위해 기초를 쌓고 싶은 분"
밑바닥부터 시작하는 비트코인 (파이썬으로 직접 구현하며 배우는 비트코인),https://search.shopping.naver.com/book/catalog/32436327982,https://shopping-phinf.pstatic.net/main_3243632/32436327982.20221230072151.jpg,송재준,29700,한빛미디어,20191101,9791162242230,"비트코인 코어를 구현하면서 배우는 비트코인 이론과 실제

비트코인은 블록체인 기술의 집약체입니다. 이더리움, 이오스 같은 2, 3세대 블록체인은 비트코인을 바탕으로 확장, 발전한 개념입니다. 디앱 개발에서 머무르지 않고 블록체인 개발자로 성장하기 위해서는 ‘비트코인 코어’를 가장 먼저 배워야 합니다. 무한한 상상력을 블록체인 기술로 실현하려면 비트코인 코어의 구성 요소와 작동 원리를 이해하고 구현할 수 있어야 합니다.

이 책은 비트코인 코어의 구성요소를 파이썬으로 직접 구현하면서 비트코인 핵심을 깊이 이해할 수 있습니다. 유한체 기본부터 암호화폐를 이루는 수학과 암호학, 블록, 트랜잭션을 파헤치고 블록체인 결제 시스템까지 확장합니다. 이 책을 마치면 비트코인 코어에 필요한 핵심 요소를 직접 코딩하면서 암호화폐라는 무대 뒤에서 무엇이 어떻게 돌아가는지 알게 됩니다. 트랜잭션을 생성하고 P2P 네트워크에서 데이터를 가져와 네트워크 프로토콜에 따라 트랜잭션을 전파시킬 수 있습니다. 블록체인으로 응용프로그램이나 서비스를 개발하거나 이 분야에 처음 뛰어든 사람은 반드시 읽어야 하는 책입니다."
한 권으로 끝내는 코딩테스트 with 파이썬 (네카라쿠배 취업을 위한 완벽 가이드),https://search.shopping.naver.com/book/catalog/41491550630,https://shopping-phinf.pstatic.net/main_4149155/41491550630.20230808085502.jpg,윤성환,34200,상상아카데미,20230814,9791185402451,"코딩테스트를 준비하는 취준생의 필독서!
 
『한 권으로 끝내는 코딩테스트』는 네카라쿠배(네이버, 카카오, 라인, 쿠팡, 배달의민족)로 대변되는 IT 기업의 취업 또는 이직을 준비하는 취준생들의 코딩테스트를 위해 쓰여졌다. 
 
이 책은 백준 온라인 저지 사이트 외부 출제자 기여도 1위인 저자가 최근 기출 문제들을 분석하고 직접 문제를 출제했다. 또한, 기초부터 실전까지 단계적인 학습이 가능하도록 문제들을 선별하여 제공하였으며, 백준 온라인 저지에 있는 유사 문제와 IT 기업 기출 문제의 풀이도 함께 제공하여 코딩테스트에 완벽히 대비할 수 있도록 도와준다. 취업과 이직을 위해 준비하는 모든 수험생들에게 강력한 지침서가 되어 줄 것이다."
