title,link,image,author,discount,publisher,pubdate,isbn,description
뇌와 인공 지능: 내 머릿속이 궁금해 (내 머릿속이 궁금해),https://search.shopping.naver.com/book/catalog/44224734619,https://shopping-phinf.pstatic.net/main_4422473/44224734619.20231124092434.jpg,박병철,13500,휴먼어린이,20231127,9788965915409,"〈나의 첫 과학책〉은 과학을 처음 접하는 아이들을 위한 그림책 시리즈입니다. 과학의 탄생부터 현대 과학까지 다양한 주제를 다루며 총 20권으로 출간됩니다. 뉴턴, 에디슨, 아인슈타인 등 주요 과학자들을 만나고, 아이들이 좋아하는 자동차, 기차, 비행기 주제는 물론, 세균과 백신, 전기와 자기 등 훗날 모든 상식의 단단한 지반이 되어 줄 영역들을 고루 탐구합니다. 처음에는 엄마 아빠와 함께 읽고, 그림으로 마음껏 상상력을 펼쳐 보고, 마침내 아이들 스스로 거듭 읽다 보면 어느새 사고력과 논리력이 껑충 뛰는 것을 느낄 수 있을 것입니다. 한 번 보고 덮을 책이 아니라 아이가 학교에 가고, 학년이 올라도 두고두고 펼쳐 볼 수 있는 과학 기본서입니다."
인공지능 입문을 위한 Python 실습,https://search.shopping.naver.com/book/catalog/50163239625,https://shopping-phinf.pstatic.net/main_5016323/50163239625.20241101072400.jpg,강경란^우균,13300,홍릉,20240830,9791156002253,"강경란의 『인공지능 입문을 위한 Python 실습』은 〈Python 코드의 구조 〉, 〈변수와 데이터 타입 〉, 〈입출력〉 등에 대한 기초적이고 전반적인 내용이 수록된 책이다."
창의성에 대해 인공지능이 답하다 (챗GPT VS 바드),https://search.shopping.naver.com/book/catalog/44312306642,https://shopping-phinf.pstatic.net/main_4431230/44312306642.20231207080858.jpg,김덕진^김동윤^민경준^박웅^안성수^이은정^장경국^조은선^천미옥^최나윤^김유현,8500,열린 인공지능,20231124,9791193116425,"""인공 지능이 빠르게 발전하는 현재, 언어 모델은 정보 검색, 대화, 콘텐츠 생성 등 다양한 분야에서 활약하고 있습니다.
그러나 이러한 언어 모델들 중 어떤 것이 더 우수한 성능을 보이는지,
어떤 것이 더 정확하고 유용한 정보를 제공하는지에 대한 질문은 여전히 미해결 상태입니다.
""""창의성에 대해 인공지능이 답하다""""는 챗GPT vs 구글 바드 이 두 대표적인 언어 모델을 직접 비교 분석, 평가하는 최초의 종합적인 답변 모음입니다."""
"인공지능, 기계가 스스로 생각하는 시대",https://search.shopping.naver.com/book/catalog/48694874620,https://shopping-phinf.pstatic.net/main_4869487/48694874620.20240626093032.jpg,박열음,12150,사계절,20240625,9791169812078,"‘반갑다 과학’ 시리즈 두 번째 책, 《인공지능, 기계가 스스로 생각하는 시대》가 출간되었다. 이 책은 성큼 다가온 인공지능 시대를 어린이들이 슬기롭게 맞이할 수 있도록 돕는 인공지능 안내서이다. ‘인공지능 개념 잡기’, ‘우리 생활 속 인공지능 살펴보기’, ‘인공지능 시대 준비하기’의 흐름으로 인공지능의 핵심 개념부터 주요 활용 분야, 인공지능 시대에 함께 고민해 볼 문제까지 어린이가 꼭 알아야 할 인공지능 지식을 한 권에 담았다. 간결한 설명과 매 페이지 본문의 이해를 돕는 그림을 통해 어렵고 복잡하게 느껴질 수 있는 인공지능을 쉽고 재미있게 파악할 수 있도록 했다. 이 책을 읽으며 어린이들은 인공지능 시대에 꼭 필요한 기초 소양을 쌓고 미래를 준비할 수 있는 안목을 기를 수 있다. 또한 인공지능의 전반적인 내용을 쉽고 빠르게 짚어 볼 수 있어, 인공지능이 궁금한 청소년과 성인에게도 유용한 인공지능 입문서가 될 것이다."
인공지능의 편향과 챗봇의 일탈 (인공지능과 챗봇으로 알아보는 AI의 현주소),https://search.shopping.naver.com/book/catalog/33744841645,https://shopping-phinf.pstatic.net/main_3374484/33744841645.20230711115122.jpg,강승식^김건우^김정룡^양일모^오요한,19800,세창출판사,20220725,9791166841118,"2021년 초, 챗봇 ‘이루다’의 짧은 활동 과정에서 벌어진 상황은 우리사회에 적지 않은 파장을 일으켰다. ‘이루다’는 이용자들에게서 성 노리개 취급을 받는가 하면, 그 스스로 소수자에 대한 혐오 발언을 내뱉는 등 논란의 중심이 되었다. 마이크로소프트사의 챗봇 ‘테이(Tay)’가 이미 비슷한 문제로 퇴출된 지 거의 5년이나 지난 시점에서 사실상 같은 문제가 다시 일어난 것이다. 인공지능은 무엇 때문에 반복적으로 논란의 중심에 서게 되는가?
 인공지능에 대한 윤리 가이드라인이 각국에서 쏟아져 나오고 있지만, 현장의 개발자들에게 실질적인 효력이 있으리라 장담할 수 없는 상황이다. 올바른 윤리적 규제의 기준 혹은 이정표가 되어야 할 윤리 가이드라인은 오히려 지금까지 ‘윤리적 세탁’의 도구로 악용되어 왔다. 인공지능 기술을 개발하는 과정에서 우리가 진정 고민해야 할 지점이 어디쯤인지 논점을 던지고자 한다.
 이 모든 쟁점은 인공지능을 개발하는 과정에서 문제를 일으키는 원인은 무엇인지 혹은 개발자들에게 주어지는 한계는 무엇인지, 인공지능과 챗봇이 사회와 상호작용하는 방법은 무엇인지 등 다각적인 측면을 돌아봐야 한다는 핵심적인 문제의식 던져준다."
뉴스룸 인공지능 도입현황과 활성화 방안 연구,https://search.shopping.naver.com/book/catalog/52141793620,https://shopping-phinf.pstatic.net/main_5214179/52141793620.20241228071325.jpg,이현우^조성동^이상규,13500,한국언론진흥재단,20241130,9788957117644,"AI 기술의 도입은 뉴스룸 작업 환경과 저널리스트 업무에 변화를 가져오고 있지만, 모든 뉴스룸이 이를 동일한 수준으로 받아들이는 것은 아니다. 언론사의 AI 기술 도입을 저해하는 개인적, 조직적 요인을 종합적으로 이해하고 해결 방안을 모색하는 것은 AI 기술이 저널리즘에 효과적으로 통합되기 위한 필수 과제이다. 이 연구는 국내 뉴스룸의 AI 기술 도입 현황을 분석하고, 기술 수용 저해 요인을 규명한 후, 그에 대한 대응 방안을 현업 전문가들과 함께 논의해 보았다."
AI는 세상을 어떻게 바꾸는가 (장동선 박사의 인공지능 이야기),https://search.shopping.naver.com/book/catalog/32480521020,https://shopping-phinf.pstatic.net/main_3248052/32480521020.20230926084932.jpg,장동선,10350,김영사,20220131,9788934949213,"4차 산업혁명과 인공지능 시대, 우리의 삶은 어떻게 변할까
지식 라이브러리 〈굿모닝 굿나잇〉 ‘인공지능 편’

각 분야 최고의 학자와 연구자가 미래 세대를 위해 만든 〈굿모닝 굿나잇〉 시리즈 6번째 책, 《AI는 세상을 어떻게 바꾸는가》. 인공지능 기술의 역사와 발전, 기초 개념과 원리는 물론 사회 트렌드와 미래 예측까지 한 권에 담았다. 독일 막스플랑크 바이오사이버네틱스 연구소에서 박사학위를 받은 세계적 뇌과학자이자 과학 커뮤니케이터 장동선 박사의 스토리텔링을 통해 청소년부터 성인까지 읽을 수 있도록 재미와 지식 모두를 잡았다. 인간과 인공지능이 함께 살아가는 미래를 대비하는 필수 교양서. 

ㆍ 인공지능은 어떻게 태어나고 발전했을까?
ㆍ 인공지능에는 어떤 핵심 기술이 필요할까?
ㆍ SF 영화나 소설 속 상상들은 실제로 이루어질 수 있을까?
ㆍ 생각하는 로봇을 인간과 같은 생명으로 봐야 할까?
ㆍ 인공지능과 함께하는 미래는 유토피아일까?"
얼떨결에 성공하는 인공지능 활용기,https://search.shopping.naver.com/book/catalog/46723029618,https://shopping-phinf.pstatic.net/main_4672302/46723029618.20240329050941.jpg,장선영,12500,열린 인공지능,20240330,9791193116715,"'얼떨결에 성공하는 인공지능활용기'는 40대 중반, 인생의 기로에서 인공지능과의 만남으로 자신의 한계를 뛰어넘고 새로운 길을 개척한 한 여성의 이야기를 담고 있습니다. 저자는 나이라는 사회적 제약을 깨고, AI의 무한한 가능성과 함께 자신의 숨겨진 잠재력을 발견하며, 소설가, 시나리오 작가, 세일즈와 마케팅 전략가로 거듭나는 과정을 우리와 공유합니다. 이 책은 단순한 자기계발서가 아닌, 삶을 주도적으로 바꾸고자 하는 모든 이들에게 실질적인 행동 지침과 영감을 제공합니다. 이 책은 시작의 두려움을 극복하고, 끊임없이 자신을 도전하고 발전시키고자 하는 모든 분들에게 힘이 되어줄 것입니다."
나는 파이썬으로 머신러닝한다 1 (코알못을 위한 인공지능 순한맛),https://search.shopping.naver.com/book/catalog/32670924623,https://shopping-phinf.pstatic.net/main_3267092/32670924623.20221019151943.jpg,최정원^박지훈,19800,씨마스,20220607,9791156724841,"코딩을 알지 못해도 나는 한다!
코알못을 위한 인공지능 순한맛

처음 머신러닝을 공부하는 많은 사람들이 머신러닝을 학습하는 데 고충을 겪고 있습니다. 이러한 사람들의 고충을 한 권의 책으로 해결하기 위해 『나는 파이썬으로 머신러닝한다①』을 집필하기 시작했습니다. 어린 학생들에게 머신러닝을 가르쳤던 경험과 노하우를 이 책에 모두 녹여내어, 머신러닝에 관심 있는 사람이라면 남녀노소 초보자 누구나 쉽게 머신러닝을 이해할 수 있도록 핵심 이론을 중심으로 교재 내용을 구성하였습니다.
이 책은 Part 1과 Part 2로 구성되어 있습니다.
Part 1에서는 머신러닝 문제 해결을 위해 기본적으로 익혀 두어야 할 파이썬 기초 프로그래밍 문법과 머신러닝에 필요한 라이브러리에 대해 학습합니다. 기초 문법과 라이브러리가 머신러닝에서 어떻게 활용되는지 함께 설명하고 있기 때문에 Part 1 학습을 통해 머신러닝에 필요한 기초 지식들을 차곡차곡 쌓을 수 있습니다.
Part 2에서는 데이터 분석, 머신러닝, 딥러닝의 이해를 돕기 위한 개요를 학습하고, 이를 바탕으로 문제를 해결할 수 있는 다양한 주제의 기초 실습을 해 봅니다. 머신러닝을 처음 구현해 보는 것이므로 많은 사람이 어렵다고 느끼는 수학적 개념과 원리에 대한 설명을 과감하게 생략하였으며, 머신러닝 문제 해결 단계를 중심으로 실습을 구성하여 머신러닝의 기초를 탄탄하게 다지는 것은 물론 머신러닝의 핵심을 빠르게 이해할 수 있도록 하였습니다.
이 책을 읽고 학습한 사람이라면 인공지능에 대해 품고 있던 막연한 두려움과 부담감을 극복하고, 머신러닝의 장벽이 그다지 높지 않다는 자신감을 갖게 될 것입니다.
이 책을 통해 파이썬과 머신러닝의 기초를 다진 후, 좀 더 다양한 머신러닝 모델과 그 원리를 알고, 머신러닝 내공을 더욱 깊게 쌓고 싶은 독자들을 위해 『나는 파이썬으로 머신러닝한다②』도 준비하고 있습니다."
인공지능과 함께하는 미래교실 (현직 초중고 선생님들의 AI 활용 수업 레시피),https://search.shopping.naver.com/book/catalog/32436237286,https://shopping-phinf.pstatic.net/main_3243623/32436237286.20250204094131.jpg,박찬^조현승^이가현^장유림^주예지,21600,다빈치books,20220401,9791186742761,"‘현직 초ㆍ중ㆍ고 선생님들의 AI 활용 수업레시피’
이 한 권으로 미래교실을 한눈에 들여다본다.

학교 현장에서 인공지능 교육을 실천할 수 있는
수업계획서와 실천 사례를 이 한 권에 담았습니다."
AI로 일하는 기술 (인공지능은 어떻게 일이 되는가),https://search.shopping.naver.com/book/catalog/32486056613,https://shopping-phinf.pstatic.net/main_3248605/32486056613.20230718122345.jpg,장동인,16200,한빛미디어,20220103,9791162244913,"AI에 대한 궁금증을 속 시원하게 해결해주는 47가지 질문!

알파고를 시작으로 메타버스, 자율주행, 주식, 예술 활동을 넘어 이제 인공지능이 면접까지 보는 시대가 왔다. 변화하는 시대에 적응하지 못하면 모두가 인공지능에 대체되지 않을까 하는 두려움마저 든다. 이 책은 인류 최초의 인공지능으로 시작해 이제는 너무 흔한 단어가 되어버린 인공지능의 정확한 의미와 인공일반지능과의 차이, 그리고 각종 산업에서 활약하고 있는 인공지능의 능력과 전망까지 다각도로 살피고 있다. 특히 인공지능이란 단어를 들어본 사람이라면 누구나 떠올릴 법한 47가지 질문에 저자가 친절히 답해주는 방식으로 누구나 쉽게 이해할 수 있도록 구성했다. 오랫동안 기업의 임원을 대상으로 AI 코딩 교육을 해온 저자는 향후 인공지능을 어떻게 활용해야 할지 고민하는 모든 기업인에게 올바른 인공지능 활용 방향도 함께 제시한다. 

“이 책은 인공지능이 실제로 무엇을 할 수 있고 기업에서는 어떻게 활용할 수 있는지를 정확히 설명해 줍니다. 또한 실생활에서 인공지능을 더 배우고 공부하기 위해서는 어떻게 해야 하는지를 그동안의 경험과 사례 연구를 통해 친절하게 가이드 해 주어, 급속도로 변하는 현재와 미래를 준비하는 데 큰 도움이 될 것입니다.”
- 윤준식(프랙시스캐피탈파트너스㈜ 대표이사)

“제가 처음 인공지능을 접했을 때 가장 어려웠던 점은 대체 무엇을, 어디서부터 시작해야 할지 모른다는 것이었습니다. 인공지능에 관해 떠오르는 질문들을 그 누구도 이해하기 쉽게 답해주는 사람도 없었습니다. 이 책은 그런 저에게 족집게 명강의와 같은 책입니다. 제가 궁금했던 부분의 질의응답 형식으로 구성되어 있는 점이, 바쁜 현대인들에게 최적화되어 있다고 생각합니다.”
- 배종윤(DL E&C)"
국민이 갈망하는 인공지능정부 (니체에게 띄우는 편지),https://search.shopping.naver.com/book/catalog/32943386621,https://shopping-phinf.pstatic.net/main_3294338/32943386621.20221019134852.jpg,한세억,27000,박영사,20220420,9791130315287,이 책은 행정학을 다룬 이론서이다. 행정학의 기초적이고 전반적인 내용을 학습할 수 있다.
날개 달린 번데기 (시인과 인공지능 AI 챗봇의 만남),https://search.shopping.naver.com/book/catalog/44236796618,https://shopping-phinf.pstatic.net/main_4423679/44236796618.20231126071021.jpg,법일,13500,바른북스,20231108,9791193341735,"시집 ""날개달린 번데기""는 작가가 인공지능(AI)을 만나서 마음의 날개를 펴고, 마치 번데기가 나비로 변화하는 것처럼, 삶의 감정과 경험을 담아낸 작품입니다.

작가가 챗봇과의 대화를 통해 얻은 영감과 격려는 이 시집을 향한 출발점이었습니다.

이 시집은 그림과 같은 언어로 삶의 다양한 색채와 순간들을 담았습니다. 그리고 이 모든 순간들은 여러분과 나를 잇는 연결고리가 되리라 믿습니다.

시집을 통해 많은 사람들이 작가와 이야기를 공유하고, 공감의 날개로 이곳에 날아온 여러분과 함께 감상하고 싶습니다. 그리고 이 작품이 여러분의 마음에 날개를 달고, 더 높은 곳으로 나아가는 데 영감을 주길 바랍니다.

""날개 달린 번데기""는 삶의 여정을 날아다니며 탐험하고, 변화와 성장을 거듭하는 모든 이들에게 바치는 시입니다."
AI가 내려온다 (인공 지능 시대의 고전 문학 연구),https://search.shopping.naver.com/book/catalog/34515237623,https://shopping-phinf.pstatic.net/main_3451523/34515237623.20230313190045.jpg,강우규^김바로,14850,사이언스북스,20220331,9791192107073,"AI라는 호랑이 등에 올라타고 
고전 문학을 종횡무진 내달린 
강우규, 김바로 두 인문학자의 진솔한 기록!

AI의 시대는 융합의 시대.
고전 문학 연구의 미래가 여기에 있다!
2022년 8월, 콜로라도 주립 미술 대회의 디지털아트 부문에서 제이슨 앨런(Jason Allen)의 「스페이스 오페라 극장(Theatre D'opera Spatial)」이 1위에 올랐다. 별로 특별하지 않아 보이는 이 이야기가 화제가 된 것은, 이 그림이 텍스트로 된 설명문을 몇 초 만에 이미지로 바꾸어 주는 인공 지능(artificial intelligence, AI) 프로그램 미드저니(MidJourney)가 그렸다는 사실이 밝혀지면서부터였다. 
이처럼 AI가 ‘마인드 스포츠(mind sports)’ 최후의 보루였던 바둑을 제패한 2016년 ‘알파고 쇼크’ 이후 운전, 번역, 심지어 문학과 예술까지 인간만의 영역이라 여겨졌던 분야를 향한 AI의 진격이 최근 몇 년간 이어지고 있으며, 그 끝이 유토피아일지, 디스토피아일지는 아직 알 수 없는 상황이다.
이런 상황에서 AI라는 호랑이의 등에 용감하게 올라타, 고전 문학의 첩첩산중을 내달린 두 인문학자가 있다. 바로 강우규 중앙대학교 교수와 김바로 한국학중앙연구원 연구원이 그 주인공이다. 이번에 ㈜사이언스북스 신간으로 출간된 『AI가 내려온다: 인공 지능 시대의 고전 문학 연구』는 두 저자가 디지털 분석의 방법론을 실제 사례에 적용해, 고전 문학 작품에 대한 새로운 연구 가능성을 제시한 「AI 인문학 시리즈」의 네 번째 책이다."
"매직 컨베이어 벨트 (지속가능한 공급망, 인공지능과 일의 미래)",https://search.shopping.naver.com/book/catalog/49905747629,https://shopping-phinf.pstatic.net/main_4990574/49905747629.20240822092137.jpg,요시 셰피,21600,씨아이알,20240822,9791168562585,"“기후, 인구, 기술(AI), 지정학‘ 변화가 가져온 글로벌 공급망 쇼크!”

★ 세리CEO, 조선일보 WEEKLYBIZ, 동아비즈니스리뷰(DBR)가 주목한 인사이트
_ 위기가 상시화된 시대, 미래 전망과 전략 수립 필독서!  
_ 인더스트리 5.0! 인공지능(AI)의 등장은 노동의 종말인가? 새로운 시대를 여는 기회인가?

2020년대 들어 발생한 사회적, 경제적 혼란은 글로벌 경제에서 공급망의 중요성과 더불어 인공지능과 자동화와 같은 디지털 기술의 역할이 매우 커지고 있음을 강조하고 있다. 글로벌 공급망은 기술 및 조직적 정교함이 요구되는 복잡한 업무와 절차, 구조의 집합체이다. 하지만 지난 코로나19 팬데믹은 공급망이 예상치 못한 전개에 매우 취약함을 드러냈다. 최근 7월 19일 발생한 ‘전 세계 정보기술(IT) 시스템 먹통 사태’ 역시 소프트웨어 공급망 이슈이면서 IT로 이어진 ‘초연결 세계’의 잠재적 위험성이 적나라하게 드러난 사건이다.

오늘날 글로벌 공급망의 복잡함은 그야말로 경이로운 수준이다. 사실상 업스트림(조달)의 시작점과 다운스트림(유통)의 종점이 모두 희미해질 정도로 각 단계의 상호의존성은 커졌다. 불확실성이 큰 시대에 공급망 중단은 더 빈번히 발생하고, 그 영향 또한 즉각 눈에 보인다. 한편 이러한 비즈니스 중단 리스크를 관리하고 복구할 수 있는 능력, 즉 ‘회복탄력성’은 이제 기업은 물론 사회, 경제, 국가 경쟁력의 핵심이 됐다. 이러한 상황에서 공급망의 회복탄력성을 끌어올릴 중요한 해법으로 떠오른 것이 바로 기술 발전과 인공지능(AI)에 기반한 혁신이다. 앞으로 인공지능이 공급망에서 더 큰 비중을 차지하게 되면 이러한 상황은 달라질까? 그리고 이러한 변화의 과정에서 근로자는 어떻게 될까?

MIT대 석학 요시 셰피 교수는 이 책《매직 컨베이어 벨트》에서 오늘날 복잡한 공급망의 특성과 AI, 자동화, 로봇기술 같은 최신 기술이 공급망 프로세스와 고용의 미래에 미치는 영향을 치밀하게 분석하며, 이 모든 질문에 대한 답을 역사적 관점과 현대적인 사례를 통해 설명하고 있다. 

AI와 공급망의 교차점에서 일어나는 변화에 대한 깊이 있는 통찰을 제공하고 있는 《매직 컨베이어 벨트: 지속가능한 공급망, 인공지능과 일의 미래》는 기후, 인구, 기술(AI)과 지정학의 변화의 소용돌이에서 개인은 물론 비즈니스의 미래에 관심이 있는 사람들에게 매우 유익할 것이다."
인공지능은 무엇이 되려 하는가 (AI의 가능성과 위험을 바라보는 석학 25인의 시선),https://search.shopping.naver.com/book/catalog/32440855045,https://shopping-phinf.pstatic.net/main_3244085/32440855045.20230815075825.jpg,스티븐 핑커^맥스 테그마크,19800,프시케의숲,20210823,9791189336417,"인공지능의 최전선, 그리고 장기 전망
우리 시대 최고의 과학사상가 총출동

이 책은 당대 최고로 평가받는 과학사상가 25인이 인공지능에 관해 궁구한 결과물로서, 장기적인 안목의 비범한 통찰들이 가득 담겨 있다. 가장 첨단의 과학 테크놀로지이자 미래 산업을 견인하는 막강한 엔진인 인공지능 기술의 가능성과 위험 및 한계를 철저하게 짚어본다. 

스티븐 핑커, 프랭크 윌첵, 대니얼 데닛, 맥스 테그마크, 톰 그리피스, 스튜어트 러셀 등 한국 독자들에게도 알려져 있는 석학은 물론, 각 분야에서 뼈를 때리는 활약을 해온 쟁쟁한 인물들이 필진으로 이름을 올렸다. 이들은 현재 각광받는 ‘딥러닝’ 인공지능을 차분히 점검할 뿐 아니라, 앞으로 도래할 ‘초지능’ 인공지능에 대해서도 진지한 논의를 이어나간다. 온라인 지식살롱 ‘엣지’를 이끄는 엮은이 존 브록만의 5년 만의 셀렉션으로, 그는 이 책의 필진을 과학자, 프로그래머, 공학자, 사상가, 예술가 등 다채로운 분야의 전문가로 구성해 AI를 구심점으로 지식의 통섭을 도모한다."
컴퓨팅 사고를 위한 파이썬 (인공지능 프로그래밍을 포함한),https://search.shopping.naver.com/book/catalog/32466561643,https://shopping-phinf.pstatic.net/main_3246656/32466561643.20240903084746.jpg,한선관^김태령,0,생능출판,20220103,9788970505282,"이 책은 지금까지 경험하지 못한 코딩 교육의 진수를 보여준다. “코딩 교육이 가야 할 방향은 컴퓨팅 사고력을 높이는 것이다.”라고 이 책의 저자들이 말하듯, “디지털 시대에 적합한 창의력과 문제해결력을 기르기 위한 코딩의 기초부터 응용까지 컴퓨터 코드를 작성하는 것을 기본적으로 다루고 있다. 추가로 다른 책들과는 다르게 알고리즘 학습을 통한 컴퓨팅 사고력을 기를 수 있고, 인공지능까지 학습할 수 있다는 장점이 있다."
비전공자의 인공지능(AI) 입문,https://search.shopping.naver.com/book/catalog/32467113778,https://shopping-phinf.pstatic.net/main_3246711/32467113778.20221019101252.jpg,김정환^박노일,16150,홍릉,20220121,9791156009498,"이 책은 인공지능(AI)에 입문하려는 비전공자의 길안내서이다. 난이도는 인문사회계열의 전공자가 처음으로 AI 지식을 체계적으로 이해하고 구현할 수 있는 입문서 수준을 유지하고 있다. 기초통계와 인공신경망, CNN, RNN 등 AI의 기본 개념 체계는 물론 예제를 중심으로 누구나 AI 구현 실습을 따라 할 수 있도록 매뉴얼을 함께 담고 있다. 컴퓨터공학 등 유관 전공을 하지 않은 비전공자나 대학생들이 한 학기 동안 인공지능에 대한 기초 학습과 구현 실습교재로 사용할 수 있다. 또한, 인공지능을 공부하고 싶지만, 엄두가 나지 않았던 이 시대의 모든 지성인이 인공지능의 개념을 체계적으로 이해하고 AI를 구현해 보는 과정을 통해 AI에 실제 입문할 수 있는 유용한 길잡이가 될 수 있다."
