title,link,image,author,discount,publisher,pubdate,isbn,description
인공지능 교과서 3: 고급편 (중.고등.대학생을 위한),https://search.shopping.naver.com/book/catalog/35623565620,https://shopping-phinf.pstatic.net/main_3562356/35623565620.20221228072104.jpg,사이언스주니어인공지능연구회,17100,광문각,20221031,9788970932385,"4차 산업혁명 시대! 미래는 어떻게 바뀌는가?
10대들을 위한 미리 배우는 AI의 기술!

인공지능은 인류를 위한 지구상에서의 마지막 기술이다. 인공지능 다음 세대는 인공지능 로봇을 앞세워 우주를 정복하는 세대가 다가올 것이다. 앞으로는 고등 수학이 사용되는 계산법으로는 지금까지 배워 온 인류의 지식 한도를 넘기게 된다. 본 교재를 통하여 인공지능 근본 원리를 이해하고, 수천 년간 학자들이 정의한 수학으로 인공지능 계산법을 익혀야 한다. 그리고 공용 언어인 영어로 과학(수학, 물리학 등)을 이해해야 세계 인공지능 개발자들과 함께 토의하고(오픈소스 커뮤니티), 지능 지식 기술의 해결점을 찾을 수 있다.
예를 들어 학생들은 인공지능 전문가가 되려면, 음악의 오케스트라 악단장·지휘자 ·공연 감독자처럼 되어야 한다. 일반 비즈니스 성공은 연주자(기획가)가 되기만 해도 된다. 인공지능 비즈니스와 예술 중 피아노 부문과 비교해 보면, 인공지능 기획·설계·개발은 음악 예술의 피아노 제작자·작곡가·연주가를 합쳐 놓은 것과 같다. 인공지능 개발자 한 명이 제대로 된 지능 시스템 설계를 하면 수만 명을 먹여 살릴 수 있는 창조 시스템을 개발할 수 있다.
인류가 가진 문제 중 인공지능으로 문제를 해결하려면 설계 능력이 있어야 한다. 설계를 하려면 기획 능력을 갖추어야 하고, 기획은 근본 원리를 이해하여야 한다. 특히 창의적인 발상은 자유로운(Story Telling) 생각이 있어야 한다. 이는 독서를 통해서 이루어 진다는 것이 많은 전문가(아인슈타인, 빌 게이츠 등)에 의해서 입증된 바가 있다.

본 교재의 내용은 인공지능 기본 원리 중심의 알고리즘을 통하여 실험학습 방식으로 기초 해법을 구현할 수 있도록 하였다. 기본 원리의 보편화된 지도학습, 비지도학습, 강화학습으로 나누어진다. 지도학습은 2장에서 6장까지 구성하였으며, 비지도학습은 6장부터 8장으로 구성되어 있다. 그리고 9장에서는 인공지능 강화학습으로 알파고 사례를 들어 설명하였다. 앞으로 인공지능 원리는 슈퍼 인공지능이 탄생하기까지 무한한 진전이 있을 것이다. 이를 통하여 학습한 것을 다양한 상상력으로 기획·설계와 프로젝트를 구현하고 창조하길 바란다. 학습용 빅데이터는 준비(AI 허브: www.Aihub.or.kr)하고 있다. 이 과정에서 창조의 즐거움과 발전이 있을 것이다.
인공지능 기술 개발 핵심인 프로그램의 쉬운 코드부터 시작해서 핵심적인 내용을 차분히 지식을 습득하면 인공지능 기획 설계·개발자가 될 수 있다. 여기에서 툴킷(프로그램 개발 도구)은 구글의 교육자와 학습자가 신뢰하는 코딩 교육으로서 맞춤형 원스톱 코딩 플랫폼(mblock.makeblock.com)을 개발 도구(Phython, Tensor flow) 모델을 활용하기 바란다.
기초 이론을 튼튼히 하여 논리적으로 토론하고, 호기심을 가지고 “왜?” 하는 질문과 함께 최적의 해결 방법을 찾는 사고 능력을 배양하여야 한다. 혁신 중심의 인공지능 기획·설계·개발에서 시키는 대로 코딩만 수행하는 인재는 설명이 어려워진다. 슈퍼 인공지능의 해법은 인류의 숫자만큼이나 많이 존재할 것이다."
파이썬 기반 금융 인공지능 (파이썬과 케라스를 활용한 금융 시계열 데이터 기반 알고리즘 트레이딩전략),https://search.shopping.naver.com/book/catalog/34855302621,https://shopping-phinf.pstatic.net/main_3485530/34855302621.20230920072858.jpg,이브 힐피시,37800,한빛미디어,20220928,9791169210300,"통계적 비효율성부터 벡터화된 백테스팅, 알고리즘 트레이딩까지,
금융 전문가를 위한 인공지능 활용법

이 책은 금융권에서 AI를 활용하는 금융 전문가를 위한 인공지능 활용 실전 지침서다. 책의 초반부에서는 지도 학습, 초지능 등 일반적으로 활용되는 AI의 핵심 개념을 소개한다. 그다음 AI를 이용해 금융 시장에서 통계적 비효율성을 찾아내는 방법으로 내용을 확장한다. 그리고 어디에서도 배울 수 없는 통계적 비효율성에 AI 알고리즘을 더해 알고리즘 트레이딩에서 경제적 비효율성을 역이용하는 방법을 설명한다. 마지막으로 신경망 훈련을 위한 파이썬 코드 예제와 금융 시계열 예측을 소개하며 이 책을 마무리한다. 이 책을 따라 모든 학습을 마치고 나면 AI를 활용해 기존의 금융 시스템에 디지털 혁신을 가져올 금융 전문가로 거듭나 있는 자신을 발견하게 될 것이다.

●	AI와 초지능에서 활용되는 AI의 핵심 개념과 알고리즘
●	데이터 기반 금융, AI, 머신러닝이 금융 이론과 실무에 영향을 미치는 이유
●	신경망과 강화 학습을 금융 시장의 통계적 비효율성에 적용
●	백테스팅과 알고리즘 트레이딩을 통해 경제적 비효율성 활용"
"인공 지능 로봇, 어디까지 아니? (인공 지능 로봇과 친구가 되는 가장 즐거운 방법!)",https://search.shopping.naver.com/book/catalog/45040365633,https://shopping-phinf.pstatic.net/main_4504036/45040365633.20240106070759.jpg,이경준,11700,고래가숨쉬는도서관,20231226,9791192817309,"『인공 지능 로봇, 어디까지 아니?』는 ‘탐험하는 고래’의 열두 번째 책입니다. ‘탐험하는 고래’는 세상의 모든 호기심을 탐구하는 어린이 지식 정보 시리즈입니다. 
세상은 시시각각 변화하고 있고, 이제는 로봇과 인간의 미래를 떨어뜨려 생각할 수 없을 만큼 로봇과 인공 지능의 발전 속도가 빠릅니다. 변화하는 시대에 살아가는 아이들에게 인공 지능이 바꿀 미래의 모습을 보여 주고, 아이들이 세상의 변화에 대비할 수 있도록 로봇과 인공 지능의 역사, 인공 지능이 보여 줄 가까운 미래의 모습에 대해 이야기하는 책입니다. 아이들의 미래에는 지금보다 더 발전되고, 더 정밀한 인공 지능 로봇들의 도움을 받게 될 것입니다. 인공 지능의 과거와 현재, 미래를 돌아보며 새로운 세계를 준비하는 데 도움이 될 수 있도록 구성하였습니다."
인공지능 시대의 주요 기술 (제4차 산업혁명 시대의 주요 핵심기술),https://search.shopping.naver.com/book/catalog/35057813618,https://shopping-phinf.pstatic.net/main_3505781/35057813618.20231018081718.jpg,배정철,13500,육일문화사,20220928,9791191268263,"우리는 지금 인공지능과 제4차 산업혁명의 시대라는 사실을 점차 깊이 인식해 가고 있다. 제4차 산업혁명의 시대는 초지능(Superintelligence)·초연결(Hyperconnectivity), 융·복합의 시대이다. 우리는 제4차 산업혁명의 시대 즉 인공지능 시대를 살아가면서 무엇을 준비해야 하는가? 이러한 시기에 이 책은 인공지능 시대의 주요 기술에 관해 다룸으로써 이 시대의 특징을 잘 파악할 수 있게 한다. 특히 제4차 산업혁명이라는 거대한 흐름 안에서 인공지능 시대의 주요 기술을 소개하고 있어서 현대와 더불어 다가올 미래의 양상을 전체적으로 조망하고 예견하는데 큰 도움이 될 것이다. 이 책은 저자의 『인공지능과 4차 산업혁명 시대에 우리 교육이 나아갈 방향』이라는 책에 대한 독자의 요청에 의해 각론 형태의 책을 출간하고자 한 것이다."
인공지능 데이터셋 활용집,https://search.shopping.naver.com/book/catalog/34820085622,https://shopping-phinf.pstatic.net/main_3482008/34820085622.20230313184745.jpg,한국교육학술정보원,18000,진한엠앤비,20220923,9791129032560,학생들이 데이터 분석을 배우는 과정에서 쉽고 편리하게 데이터셋을 활용할 수 있도록 지원하는 것을 목적으로 한다.
인공지능 윤리로 갓생살기 (KMOOC 인공지능 윤리 강의를 책으로 읽다!),https://search.shopping.naver.com/book/catalog/34221182686,https://shopping-phinf.pstatic.net/main_3422118/34221182686.20230919135159.jpg,이성태^윤미선^차규리^성하나,13500,연두에디션,20220805,9791192187648,인공지능 시대에 우리는 우리가 인간인 것에 더욱 집중해야 한다. 인간의 존재 의의에 대해 탐구하고 생각하며 ‘인간다운 사고’를 하기 위해 노력해야한다는 뜻이다. 인공지능이 강조될수록 ‘인문학’이 주목받는 것과 같은 맥락이라고 할 수 있다.
ChatGPT를 활용한 관광영어 익히기 (자연어 처리 대화형 인공지능),https://search.shopping.naver.com/book/catalog/44789731618,https://shopping-phinf.pstatic.net/main_4478973/44789731618.20231221092311.jpg,장동석^양진연,17100,대왕사,20231220,9788945691972,"""ChatGPT를 활용한 관광영어 익히기""는 관광객이 여행 시에 필요한 기본 영어 소통능력뿐만 아니라 관광업 종사자가 관광업에서 맡은바 업무를 성공적으로 수행하기 위한 필수적인 영어 능력을 개발하고 향상시키기 위한 새로운 방법을 제시하는 대학 교재입니다. 본서는 최신 언어 인공지능 기술을 활용하여 학습자들이 관광과 관련된 영어 표현과 대화를 자기주도적으로 습득하는 데 도움을 줄 것입니다."
인공지능시대와 인문치유 (주술 의술 예술에 대한 시론),https://search.shopping.naver.com/book/catalog/33179949622,https://shopping-phinf.pstatic.net/main_3317994/33179949622.20221019135615.jpg,김진국,14400,뜻밖에,20220701,9791197469473,"인공지능 같은 기계가 인간의 능력을 압도하는 시대에 ‘쓸모’라는 차원에서 제기되는 인간의 정체성에 대한 의문에 답을 찾고자 한다. 국내외 문학작품을 바탕으로 의학, 철학, 문학의 융합적 사고를 함으로써 첨단의·과학에 의해 생산, 유포되는 획일적 담론을 극복하고, 코로나19 대유행 이후의 대안을 제시한다."
엔트리로 인공지능 만들기,https://search.shopping.naver.com/book/catalog/32666434618,https://shopping-phinf.pstatic.net/main_3266643/32666434618.20230913071452.jpg,김민정,12600,마린북스,20220610,9791192119083,"인공지능을 만들어보는 경험
함께미래를 만들어가는 경험

● 다양한 과학 기술과 인공지능 기술의 개념을 배우고 이해할 수 있습니다.
● 코딩 맵을 통해 인공지능 프로그램을 한눈에 파악할 수 있습니다.
● 엔트리 코딩으로 쉽고 재미있게 인공지능을 만들 수 있습니다.
● AI 개발자가 되어 스스로 디버깅 미션을 해결하며 학습에 대한 자신감을 키울 수 있습니다."
"블록체인과 인공지능의 융합 (디지털 화폐, 금융, RWA, 인터넷, 메타버스의 미래)",https://search.shopping.naver.com/book/catalog/44803404623,https://shopping-phinf.pstatic.net/main_4480340/44803404623.20231224070858.jpg,한승무,18000,북코리아,20231215,9788963243108,"블록체인과 인공지능의 융합이 열어줄 새로운 세상

블록체인과 인공지능은 다양한 분야에서 혁신적인 변화를 가져올 것이다. 금융, 의료, 공공 서비스, 사회적 문제 해결 등 여러 분야에서 블록체인은 거래 비용과 시간을 줄이고, 신원 인증과 신용 평가를 간소화하고, 부정 행위와 사기를 방지하고, 새로운 금융 상품과 서비스를 만들 수 있다. 예를 들어, 블록체인은 국경을 넘어서도 쉽게 송금하고, 계좌가 없는 사람들에게도 금융 서비스를 접근할 수 있게 하거나, 창작자들에게 저작권 보호와 공정한 보상을 보장할 수 있다. 인공지능은 우리의 취향, 성격, 감정, 취미 등을 파악하고 맞춤형 대화를 제공하는 친구, 가족, 상담자, 교사, 의사 등 다양한 역할을 수행할 수 있으며, 다른 언어를 구사하는 사람들과 대화할 때도 실시간으로 통역해줄 수 있다. 예를 들어, 인공지능은 우리의 정신건강, 학습능력, 창의력 등을 향상시키는 데 도움을 주거나 다른 문화와 소통하는 능력을 강화시켜줄 수 있다. 또한, 인공지능은 업무를 대체하거나 보조하며 다른 분야에서 우리와 함께하고 있다.
이 책은 블록체인과 인공지능이라는 복잡해 보이는 주제를 쉽게 이해하고 공감할 수 있도록 구성되어 있다. 또한, 기술에 익숙하지 않은 일반인도 쉽게 접근하여 현대 디지털 기술의 진화와 그 중심에 있는 두 기술의 중요성을 느낄 수 있다. 블록체인과 인공지능이라는 두 기술이 서로 어떻게 상호작용하면 서 혁신의 바람을 일으키는지, 그리고 그것이 어떻게 우리의 미래와 일상에 파급효과를 미치는지에 대해 깊게 살펴본다."
4차 산업혁명과 인공지능 (미래를 바꾸는 디지털 시대와 인공지능을  이해하는 44가지 질문들),https://search.shopping.naver.com/book/catalog/32473341847,https://shopping-phinf.pstatic.net/main_3247334/32473341847.20231003084618.jpg,신성권^서대호,12600,팬덤북스,20220428,9791161692036,"어렵고 난해할 줄만 알았던 4차 산업혁명과 인공지능의 개념이 쉽게 이해된다!

우리가 몰랐던 4차 산업혁명과 
인공지능에 대한 궁금증들!

4차 산업혁명하면 대부분의 사람들은 인간과 인공지능의 사이를 대결 구도로 그려놓고, 어두운 미래를 연상한다. 하지만 4차 산업혁명 시대가 인공지능과 함께 살아가야 하는 시대라면 인공지능을 경쟁과 시합의 대상으로 보기보다는 공생하여 더욱 탁월한 결과를 이끌어낼 수 있는 파트너로 보려는 자세가 필요하다. 
그런 점에서 이 책은 증기기관이 만든 1차 산업혁명부터 디지털 시대가 만든 4차 산업혁명의 과정과 개념, 그리고 그 의미를 풀어내면서, 더 나아가 4차 산업혁명과 인공지능에 대한 다양한 궁금증을 알기 쉽게 설명하고 있다. 컴퓨터, 빅데이터, 사물 인터넷, 3D 프린터, 4D 프린터, 블록체인, 코인, 자율주행차, 스마트 공장, 스마트 안경, 드론, 나노로봇 등 4차 산업혁명과 인공지능을 대표하는 핵심 기술에 대한 지식과 더불어, 미래사회에 대비하기 위해 무엇에 집중해야 하는지를 객관적으로 전달한다."
김상균 박사의 찾아라! 인공지능,https://search.shopping.naver.com/book/catalog/47161224621,https://shopping-phinf.pstatic.net/main_4716122/47161224621.20240420071007.jpg,이윤재,13500,베가북스,20240502,9791192488677,"인공지능은 무엇일까? 인공지능의 올바른 사용 방법은 뭘까요?
우주와 친구들이 펼치는 과학 대탐험!
어린이들을 위해 김상균 교수님이 쓴 『김상균 박사의 찾아라! 인공지능』 출간!

어린이 여러분, 안녕! 혹시 어린이 여러분은 인공지능이 무엇인지 알고 있어? 인공지능을 올바르게 사용하는 방법은? 우리 주위에 어떤 인공지능이 있는지, 사람과 인공지능이 소중한 사이가 될 수 있는지는 알고 있어? 아마 많은 어린이가 대답하기 어려울 거야. 그런데 말이지. 이건 어린이 여러분에게만 알려주는 비밀인데, 사실 어른들도 그렇다? 앞서 말한 질문들에 전부 대답할 수 있는 어른들은 그렇게 많지 않아. 그런데 이 책은 그 질문들에 전부 대답해 줄 수 있어! 정말 굉장한 책이지?

그렇다고 해서 이 책이 딱딱한 책인 것도 아니야! 김상균 선생님이 우리에게 인공지능이 무엇인지, 우리가 인공지능을 어떻게 활용해야 하는지 등등을 친절하게 설명해 주시지. 이 책은 어린이 여러분에게 어른들도 가르쳐 주기 어려운 인공지능을 아주 샅샅이 파헤쳐서 보여줄 거야.

이 책을 보는 어린이 여러분은 분명 과학을 좋아하는 어린이겠지? 그만큼 많은 과학 학습 만화를 읽었을 거라고 생각해. 하지만 내가 장담할게. 이 책은 지금까지 읽었던 그 어떤 과학 학습 만화보다도 재밌고 유익할 거야! 자, 그럼 우리 함께 인공지능에 대해 찾으러 떠나볼까?

- 줄거리

은하수 초등학교의 김상균 과학동아리에 
인공지능 로봇인 오토마톤이 등장!
하지만 우주는 오토마톤을 거절하고!
우주와 오토마톤은 친구가 될 수 있을까?

언제나 활기찬 은하수 초등학교. 어느 날, 은하수 초등학교의 과학동아리인 ‘김상균 과학동아리’에 인공지능 로봇인 오토마톤이 찾아온다. 오토마톤은 많은 사람들과 친구가 되고 싶어서 김상균 선생님을 찾아왔다고 한다. 하지만 우주는 친구가 되어 달라고 부탁하는 오토마톤을 거절한다. 그 모습을 본 김상균 선생님은 ‘그렇게 싸우기만 하면 사람들을 공격하는 인공지능이 만들어질 수도 있다’고 경고한다! 한편, 은하수 인공지능 연구소에서는 못된 연구소장이 음모를 꾸미고 있는데···! 못된 연구소장의 음모를 막고, 나쁜 인공지능으로 가득찬 미래를 바꾸기 위한 은하수 초등학교 과학동아리 3인방과 김상균 선생님의 우당탕탕 과학 이야기가 펼쳐진다!"
인공지능 시대의 문화기술 (초연결 시대에 발전하는 기술과 변화하는 사회 현상에 대해 알아본다!),https://search.shopping.naver.com/book/catalog/32436332915,https://shopping-phinf.pstatic.net/main_3243633/32436332915.20230913071504.jpg,두일철^오세종,20900,한빛아카데미,20220302,9791156645931,"인공지능 시대의 문화기술을 사례 중심으로 설명하는 IT 교양서

이 책은 인공지능 시대의 문화기술과 사회변동 현상을 알아보는 IT 교양서입니다. 먼저 인공지능 시대에 변화하는 사회를 4차 산업혁명, 인공지능, 로봇으로 나누어 설명합니다. 그리고 애플, 닌텐도, 구글, 마이크로소프트 등 최신 기업 사례를 토대로 발전된 기술을 확인합니다. 다음으로 통신기술과 영상기술의 변화가 사회에 어떤 영향을 끼치는지 학습합니다. 마지막으로 가상현실과 증강현실 등 앞으로 주목해야 할 다양한 미래기술에 대해 살펴봅니다. 

※ 본 도서는 대학 강의용 교재로 개발되었으므로 연습문제 해답은 제공하지 않습니다."
인공지능·빅데이터 마케팅,https://search.shopping.naver.com/book/catalog/32504336034,https://shopping-phinf.pstatic.net/main_3250433/32504336034.20230808084513.jpg,이원준,10800,커뮤니케이션북스,20220407,9791128816864,"인공지능에 기반한 마케팅 자동화 솔루션들이 글로벌 IT기업을 중심으로 속속 도입되고 있다. 빅데이터의 분석으로 개별 소비자의 다양한 이용 행동과 선호하는 미디어에 맞춤형 광고를 제공하는 노력도 보편화 되었다. 이메일과 뉴스레터 발송, 판촉 활동 등을 맞춤화해 주는 자동화된 메일링 서비스, 쇼핑몰의 고객 관리에 사용되는 맞춤화된 챗봇(chatbot) 서비스, 음성인식 기반의 지능형 비서 에이전트, 고객관리를 자동화해 주는 서비스들이 기업의 마케팅 업무에 활용되는 경우들이 증가하면서 마케팅 환경이 기술 안으로 빨려 들어가고 있다."
인공지능과 윤리(큰글씨책),https://search.shopping.naver.com/book/catalog/32494027743,https://shopping-phinf.pstatic.net/main_3249402/32494027743.20221019125200.jpg,김효은,23750,커뮤니케이션북스,20220401,9791128817915,자율 시스템으로서 인공지능에는 정보 보안을 넘어선 윤리적 문제들이 있다. 인공지능과 뇌의 연결 기술 등은 비교적 파급력이 크고 즉각적으로 효용을 제공하기 때문에 충분한 윤리적 숙고 과정 없이 사회에 수용되는 경향이 있다. 때문에 윤리적 문제들을 미리 예측하고 논의해 방향을 설정하지 않으면 사회적 문제가 발생할 수 있다. 인공지능 시대 이전에는 윤리를 도외시해도 기술 발전이나 생산으로 얻는 이익에 큰 타격을 받지 않았으나 인공지능 시대는 윤리 문제를 해결해야만 기술 발전과 이익 확보가 가능하다.
나는 인공지능을 변호한다 (메타버스를 건너 디지털 대전환까지),https://search.shopping.naver.com/book/catalog/32441014158,https://shopping-phinf.pstatic.net/main_3244101/32441014158.20230815082421.jpg,이상직,15300,이다북스,20220325,9791191625356,"우리는 인공지능 시대를 어떻게 마주해야 할까? 정보통신과 개인정보, 테이터 관련 업무를 맡아온 이상직 변호사가 그간의 활동을 토대로 《나는 인공지능을 변호한다》를 출간했다. 새로운 시대의 지속 가능한 과학기술의 발전과 대중화는 필수적이다. 이 책은 정치, 사회, 문화적 관점에서 인공지능을 이해하고, 혁신을 넘어 공존의 길을 찾는다."
인공지능윤리와 도덕교육,https://search.shopping.naver.com/book/catalog/32486056379,https://shopping-phinf.pstatic.net/main_3248605/32486056379.20221019104650.jpg,박형빈,19800,씨아이알,20220305,9791168560376,"4차 산업혁명, 인공지능, 빅 데이터와 같은 핵심 개념이 인간 삶 깊숙이 파고들기 시작하면서 자기 스스로 학습을 통해 자율적으로 사고하며 행동할 줄 아는 인공지능의 등장과 이를 둘러싼 윤리적 문제가 급격히 대두하고 있다.
AI의 생활 침투는 곧 인간의 생명, 재산, 건강 등 우리 삶 전체와 직결되기 때문에 인공지능윤리에 대한 탐구는 인류 번영을 위한 지름길이며, 인공지능 시대를 주도할 미래세대에 대한 인공지능 윤리교육은 매우 중요하다. 
이 책은  ‘인공지능윤리와 도덕교육’이라는 주제에 대한 융ㆍ복합적 시각에서 AI 윤리 문제를 광범위하고 심층적으로 다루고 있다. 또한 AI 윤리 문제와 관련한 다양한 차원의 국내외 논의들을 분석하고 이를 바탕으로 AI 윤리에서 반드시 검토할 필요가 있는 내용들을 체계화하였다. 
AI를 둘러싼 윤리문제 뿐만 아니라 로봇윤리, 기계윤리와 같이 AI 자체에 내장할 윤리 문제까지 다차원 측면에서 고찰하였으며 교육자로 하여금 미래세대에게 인공지능윤리 문제를 어떻게 교육해야 하는가에 대해 이론적, 실제적으로 고민하게 하는 계기를 제공하고자 한다."
미래직업 다이어리 3 (메타버스 인공지능의 시대),https://search.shopping.naver.com/book/catalog/32486514721,https://shopping-phinf.pstatic.net/main_3248651/32486514721.20250204094247.jpg,오준원^김보연^이우탁^이상문^김현정,14400,다빈치books,20220321,9791186742556,"『미래직업 다이어리 3』에서는 BTS 굿즈 한글 보드게임 '라온 with BTS'의 제작자 오준원 젬블로 대표가 보드게임 개발자라는 미래직업을 소개한다. 김보연 배우가 연예인을 꿈꾸는 학생들에게 배우의 자질과 열정에 관해 소개하고, 전 CJ E&M 디지털콘텐츠 총괄을 역임하고 숏폼 콘텐츠 제작사 대표가 된 이우탁 대표가 OTT 시대 숏폼 콘텐츠 제작자라는 미래직업을 소개한다. 유튜브 '이상문TV'를 운영하는 이상문 대표가 고미술품 감정사는 어떻게 될 수 있는지에 대해 알려준다. 현재 와이즈만북스를 총괄하는 김현정 본부장은 미래 출판편집자의 길을 자세하게 소개하며 출판 전반을 소개하고 있다. 마지막으로 메타버스 가상공간을 디자인하는 홍연선 디자이너가 실내디자이너에서 온라인 가상공간 디자이너로 성장한 과정과 미래 유망 직업이 될 메타버스 디자이너에 관해 자세히 알려준다."
