title,link,image,author,discount,publisher,pubdate,isbn,description
이타주의자 (사피엔스에서 인공지능까지),https://search.shopping.naver.com/book/catalog/32490263198,https://shopping-phinf.pstatic.net/main_3249026/32490263198.20240411070902.jpg,최정규^이상수^이진우^김준홍^김학진^홍성욱^남창훈,13500,사회평론,20180409,9791162730027,"이타주의자는 유별난 존재인가? -이타주의자에게 던지는 7개의 질문

이타주의자는 유별난 존재인가? 두산아트센터 ＜2018 두산인문극장＞에서 강연으로 만나는 『이타주의자』-이타주의자에게 던지는 7개의 질문

일본에서 선로에 추락한 취객을 구하려 했던 이수현 씨나 화재를 알리기 위해 집집마다 초인종을 눌렀던 ‘초인종 의인’ 안치범 씨같이, 자신을 희생해서 다른 이를 이롭게 하는 ‘이타주의자’는 유별난 존재일까?
이 책은 ‘이타주의자’를 모든 방향에서 검토하려고 시도한다. 사회과학과 자연과학을 총동원해서 구태여 ‘이타주의자’에 대해 이야기하려는 이유는 이기적 삶이 자연스럽게 여겨지고 이타적 삶이 특이한 선택으로 받아들여지는 시대에 우리의 이런 ‘믿음’이, 이런 인간에 대한 ‘이해’가 과연 올바른 것인지 원점에서 되묻기 위해서이다. 이를 위해 철학과 역사, 경제학, 생물학 등 각 분야의 최전선에 있는 학자들이 모여 생명의 물질적 기초부터 종으로서의 사피엔스, 동서양의 철학과 뇌의 생리적 구조, 이타적 인공지능의 미래까지 들여다봄으로써 ‘이타주의자’의 존재와 ‘이타주의’의 논의를 확장해나간다. 이를 통해 인류의 탄생부터 생존까지 이타주의자와 이타주의야말로 우리 사회를 떠받치고 있는 숨은 존재이자 근본 조건임을 밝힌다. 저자들은 이타주의자가 특별한 존재가 아님을 설명하고 오히려 누구에게나 있는 이타적 본능을 ‘이기적 인간’으로 제한하는 사회적 압력이 우리 주변의 이타주의자들을, 우리 자신을 별종으로 만들고 있는 건 아닌지 묻는다.
『이타주의자: 사피엔스에서 인공지능까지』는 두산아트센터에서 4개월간 진행되는 ＜2018 두산인문극장＞의 강연집이기도 하다. 『사람, 장소, 환대』의 저자인 인류학자 김현경까지 8명의 강연자가 이타주의의 오랜 역사와 기능, 이기주의와의 유기적 관계를 성찰하는 길잡이가 되어줄 것이다."
"교육방법 및 교육공학 (인공지능 시대의, 5판)",https://search.shopping.naver.com/book/catalog/49802885699,https://shopping-phinf.pstatic.net/main_4980288/49802885699.20240911071721.jpg,백영균,20700,학지사,20240130,9788999730375,"요즘과 같이 혁신적으로 변화하는 속에서 교육도 끊임없이 진화하고 있다. 교육의 변화와 혁신의 중심에는 교육공학과 교육방법이 있다. 현대 교육은 새로운 기술과 접근방식을 통해 더욱 효과적이고 맞춤형으로 이루어지고 있고, 이 모든 것은 학생들의 학습 경험을 더욱 풍부하고 의미 있는 것으로 만들기 위한 노력의 일환이기 때문이다. 이 책은 교육과 공학 및 기술의 긴밀한 결합을 탐구하며, 교수-학습 분야에서 디지털 혁명의 측면을 다루고 있다. 교육방법과 공학에 대한 서론, 교수-학습이론과 실천, 교수-학습의 방법과 교수매체, 에듀테크, 인공지능, 원격교육 등 다양한 주제를 다루며, 이를 통해 교사와 예비교사 그리고 교육 전문가들은 학생들에게 더 나은 교육을 제공하고, 더욱 풍부하고 효과적인 학습 경험을 얻을 수 있도록 도와주려고 노력하였다."
인공지능총서 50종 세트 4 - 전50권,https://search.shopping.naver.com/book/catalog/53550577513,https://shopping-phinf.pstatic.net/main_5355057/53550577513.20250314170401.jpg,커뮤니케이션북스 편집부^인공지능총서 기획팀,540000,커뮤니케이션북스,20250319,9791143000606,커뮤니케이션북스가 출간한 인공지능총서 50종을 모았다. 실무부터 이론까지 모든 영역의 인공지능 지식을 얻을 수 있다.
"인공지능 윤리를 부탁해 (AI 리터러시, 인공지능 기술과 윤리를 이해하는 능력!)",https://search.shopping.naver.com/book/catalog/48334803618,https://shopping-phinf.pstatic.net/main_4833480/48334803618.20240620092145.jpg,허유선,14400,나무야,20240620,9791188717361,"AI 리터러시, 인공지능 기술과 윤리를 이해하는 능력!

바야흐로 인공지능과 일상을 함께하는 시대가 됐다. 배달의 민족으로 음식을 주문하고, 유튜브로 새로운 소식을 알며, 인스타그램으로 소통하고, 챗GTP의 도움을 받아 어려운 과제를 해결하기도 한다. 그러나 더 편해지고, 더 빨라지고, 효율성이 높아진 만큼 더 안전해진 것 같지 않아서 불안하다. 챗봇 이루다 사건에서도 보았듯이 인공지능이 낳고 있는 사회적 문제들 앞에서 인간의 삶은 요동친다. 인간의 지능 수준을 훨씬 뛰어넘는 초지능의 출현을 예측하는 이즈음, 인공지능 기술은 정말 인간의 삶이 좋아지도록 도움을 줄까? 전 세계 여러 나라의 정부와 거대 기업들이 앞다퉈 ‘인공지능 윤리’를 말하며 실천에 나서고 있는 이유는 뭘까?

이 책은 인공지능 기술이 인간의 삶과 사회에 어떤 영향을 미치는지 구체적으로 톺아보는 한편 인공지능 시대에서 우리가 반드시 던져야 할 10가지 질문을 통해 올바른 방향과 해법을 제시한다. 인공지능 윤리 분야의 전문가답게 저자의 설명은 철학적 깊이가 있고 구성안은 알찬 지식으로 촘촘하다. 청소년부터 읽을 수 있도록 쉬운 말로 풀어썼고, 교육 현장에서 서로의 생각을 나눠 볼 수 있게 주제별로 다채로운 토론 거리를 실었다. 독자들은 인공지능의 개념과 역사를 정확히 파악하면서, ‘기술’의 등장은 그로 인해 비롯되는 사회의 변화를 항상 동반한다는 사실을 깨닫게 된다. 인공지능 윤리(AI Ethics)의 주요 논제들과 구체적인 사례를 연결할 수 있고, 그게 왜 문제가 되는지 분명히 말할 수 있게 된다. 인공지능 기술의 개발과 활용에는 반드시 ‘가치’를 고려해야 함을, 기술과 삶, 사회, 가치는 서로 불가분의 관계임을 이해하게 된다."
인공지능과 문화 콘텐츠 산업,https://search.shopping.naver.com/book/catalog/51762204624,https://shopping-phinf.pstatic.net/main_5176220/51762204624.20241206071119.jpg,장규수,10800,커뮤니케이션북스,20241213,9791173072741,"AI는 창작과 기획의 혁신을 가능하게 하며 새로운 콘텐츠를 생성하고 기존의 한계를 넘어선 경험을 제공한다. 그러나 AI 기술의 발전은 일자리 위협과 윤리적 문제를 동반한다. 진짜와 가짜의 혼동, 지식 재산권 문제 등도 제기된다. 정책적 대응과 기술적 관리가 중요한 시점이다. AI와 인간의 협업을 통해 문화 콘텐츠 산업의 미래를 구상해야 한다."
인공지능 예술과 해석의 철학(큰글자책),https://search.shopping.naver.com/book/catalog/53550577571,https://shopping-phinf.pstatic.net/main_5355057/53550577571.20250315093059.jpg,윤주한,22500,커뮤니케이션북스,20250321,9791173077616,"인공지능이 예술을 창작할 수 있는지, 그 작품은 어떻게 해석되어야 하는지를 탐구한다. 예술의 의미가 창작자의 의도에 의해 결정되는지, 혹은 관객의 해석에 따라 달라지는지를 논의하며, 인공지능이 창의성과 예술적 가치를 가질 수 있는지 검토한다. 또한 ‘의도주의’와 ‘비의도주의’ 해석 이론을 바탕으로 인공지능 예술이 기존 예술 개념을 어떻게 변화시키는지 분석한다."
해상풍력발전과 인공지능 (머신 러닝과 데이터 사이언스 활용),https://search.shopping.naver.com/book/catalog/50796754620,https://shopping-phinf.pstatic.net/main_5079675/50796754620.20241012072657.jpg,노재규^강기원,36800,GS인터비전,20240930,9791155764824,"본 교재의 주요 목표는 해상풍력발전의 기본 개념과 인공지능 기술의 원리를 이해시키고, 이를 실제 응용에 적용할 수 있는 능력을 배양하는 데 있다. 특히, 머신러닝과 데이터사이언스를 활용하여 해상풍력발전 시스템의 성능을 최적화하고, 운영 효율성을 높이는 다양한 방법론을 다루고 있다. 이를 통해 독자들은 이론과 실무를 결합하여 해상풍력발전의 미래를 선도할 수 있는 기술적 통찰력을 얻게 될 것이다."
영화 속 인공지능(큰글자책),https://search.shopping.naver.com/book/catalog/50401789626,https://shopping-phinf.pstatic.net/main_5040178/50401789626.20240921091746.jpg,김희경,22500,커뮤니케이션북스,20240927,9791128868603,"〈메트로폴리스〉부터 〈엑스 마키나〉, 〈블레이드 러너 2049〉까지 다양한 영화 속 AI를 분석하며, AI의 발전과 인간성과의 관계를 탐구한다. 이 책은 AI가 조력자에서 경쟁자, 그리고 인간과 유사한 존재로 변모하는 과정을 영화 사례를 통해 보여 주며, AI와 인간의 공존, 윤리적 고민을 깊이 성찰한다."
처음 만나는 인공지능 (개정3판),https://search.shopping.naver.com/book/catalog/44427415620,https://shopping-phinf.pstatic.net/main_4442741/44427415620.20231206091811.jpg,김대수^김경동,24840,생능출판,20231213,9791192932385,"최근에 도입된 ChatGPT와 더불어 인공지능의 물결이 세차게 다가오고 있다. 최근 4차 산업혁명 시대에 접어들면서 인공지능의 중요성이 더욱 커지고 있다. 미국을 비롯한 세계 각국에서 인공지능의 중요성을 강조하며, 인공지능을 차세대의 시장 질서를 주도할 수 있는 핵심 기술로 주목하고 있다.
구글과 마이크로소프트를 비롯한 전 세계의 IT 기업들이 ‘AI First’를 선언했다. 그리고 많은 수의 회사들이 인공지능이란 새로운 시대적 변화의 물결에 발맞추어 인공지능 관련 조직을 신설하고 역량과 자원을 집중하고 있다.
시진핑의 책상에는 인공지능 관련 서적이 여러 권 비치되어 수시로 읽는다고 한다. 미국과 중국 사이의 무역 전쟁도 인공지능을 비롯한 첨단 기술의 첨예한 대결이 핵심적인 요소라고 볼 수 있다.
인공지능 기술은 예상보다 빠르게 성장하고 있다. 이러한 성장의 배경에는 ‘딥러닝’이 있다. 컴퓨터가 빅데이터를 분석하여 특징을 추출하고, 인공지능은 패턴을 인식하여 프로그래밍 과정을 거치지 않고도 다양하게 학습할 수 있다.
인공지능은 많은 영역에서 우리 사회를 변화시키고 있다. 4차 산업혁명의 물결과 함께 지능형 로봇을 비롯하여 많은 산업에 인공지능의 영향력이 커지고 있다. 또 인공지능은 음악, 미술, 법률의 분야뿐만 아니라 인공지능 서비스 등 우리의 일상생활에도 다가오고 있다."
특이점과 슈퍼 인공지능(큰글자책),https://search.shopping.naver.com/book/catalog/52923499787,https://shopping-phinf.pstatic.net/main_5292349/52923499787.20250211093358.jpg,허훈,22500,커뮤니케이션북스,20250214,9791173074356,"인공지능의 발전과 특이점, 그리고 슈퍼 인공지능의 가능성에 대해 탐구한다. AI는 인간의 지능을 넘어서려 하며, 이는 긍정적 변화와 동시에 심각한 사회적, 윤리적 문제를 야기할 수 있다. AI가 인간 사회에 미치는 영향을 분석하고, AI와 인간의 관계, 기술의 발전 방향을 논의한다. 특히, AI가 가져올 미래 변화에 대한 두 가지 상반된 관점을 제시하고 인간과 AI가 공존할 수 있는 방법을 모색한다."
인공지능 스도쿠 마스터,https://search.shopping.naver.com/book/catalog/48359306620,https://shopping-phinf.pstatic.net/main_4835930/48359306620.20240613083304.jpg,송태민^박유진^임승현^허영주^박경미^정재영,8000,열린 인공지능,20240610,9791194006220,"인공지능 기술의 힘을 빌려 만들어진 'AI 스도쿠 마스터'는 스도쿠 애호가들에게 최상의 퍼즐 경험을 선사합니다. 
다양한 난이도와 창의적인 퍼즐 디자인으로 짜여진 이 책은 여러분의 논리력과 문제 해결 능력을 한 단계 업그레이드 시켜줄 것입니다. 
지금까지 경험하지 못한 스도쿠의 신세계를 탐험하며, 인공지능과 함께 두뇌를 단련해보세요. 
'AI 스도쿠 마스터'와 함께라면 스도쿠의 진정한 마스터로 거듭날 수 있습니다. 

인공지능이 만들어낸 퍼즐의 매력에 빠져보세요!"
인공지능총서 50종 세트 2,https://search.shopping.naver.com/book/catalog/51672889621,https://shopping-phinf.pstatic.net/main_5167288/51672889621.20241203081513.jpg,커뮤니케이션북스 인공지능총서 기획팀,540000,커뮤니케이션북스,20241202,9791173075162,커뮤니케이션북스가 출간한 인공지능총서 50종을 모았다. 실무부터 이론까지 모든 영역의 인공지능 지식을 얻을 수 있다.
"넥스트 인텔리전스 (인공 지능 시대, 인류의 다음을 설계하다)",https://search.shopping.naver.com/book/catalog/53466174466,https://shopping-phinf.pstatic.net/main_5346617/53466174466.20250314093229.jpg,로랑 알렉상드르,28800,열린책들,20250310,9788932925011,"인공 지능 vs 인간 지능
지능의 미래에 대한, 가장 통렬한 인사이트!

지능이 모든 가치보다 더 앞서는 인지 자본주의 시대,
그리고 그 속의 인간과 인공 지능
2013년에 페이스북은 왓츠앱을 220억 달러에 인수했다. 이것은 IT 천재 55명으로 구성된 회사가 21만 명의 직원을 가진 푸조의 가치(120억 달러)보다 훨씬 더 큰 값어치가 있음이 공식화된 일이었다. 디지털 자원이 주 원동력이 되면서 이러한 사례는 일반화되고 있다. 이 모든 것은, 지능이 그 무엇보다 큰 가치를 창출하는 핵심 자원이 됨과 동시에, 사회에 강한 영향력을 발휘하고 성공과 위치를 결정하는 인지 자본주의 시대가 되었기 때문이다. 이 사회에서 높은 지능을 가진 사람들은 더 많은 기회를 얻고, 큰 부를 축적하며, 사회적 영향력을 행사하기 쉬워졌다. 반면, 그렇지 못한 사람들에게는 빈부격차를 심화시키며, 사회적 불평등을 더욱 고착화하고 있다.
오랫동안 지능의 차이는 불가피하다는 것이 상식처럼 여겨져 왔다. 하지만 인공 지능의 등장은 이러한 고정 관념을 뒤흔들고 있다. 인공 지능은 인간이 가진 한계를 넘어설 수 있는 도구로서, 지능의 격차를 줄이고 누구나 높은 수준의 지능에 접근할 가능성을 열어 준다. 이는 곧 〈지능의 민주화〉라는 새로운 패러다임이 실현될 것임을 의미한다.
지능이 곧 가치인 사회에서, 선천적인 재능이란 천형의 사슬을 끊고 보다 월등한 지능을 갖출 수 있는데도, 인공 지능을 선택하지 않을 사람이 있을까? 인류는 이제 인공 지능이 꼭 필요하다는 사실을 깨닫고 있다. 인공 지능은 단순히 인간의 지적 능력을 보완하는 것을 넘어, 사회 전반에 걸쳐 지능의 가치를 재분배하고 평등한 기회를 제공하는 역할을 할 것이다. 인공 지능은 더 이상 〈선택〉해야 하는 문제가 아니라고 저자는 말한다. 산소처럼 우리가 살아가는 데에 반드시 있어야 하는 〈생존〉 요소가 되었다. 

인공 지능이 연 도태와 진화의 갈림길 
벌써부터 특정 작업에서 인간을 능가하는 인공 지능은 우리의 일상과 산업 전반에 걸쳐 파격적인 변화를 불러오고 있다. 그런데 우리는 이 변화를 순수하게 반기지도, 그렇다고 거부하지도 않은 채 바라보기만 하고 있다. 우리를 이렇게 주저하게 만드는 이유는 하나다. 〈인공 지능이 일으킨 변화는 과연 우리를 어디로 이끌 것인가?〉 우린 아직 이 질문의 답을 찾지 못했다.
인공 지능으로 인해 생기는 변화는 크게 두 가지일 것이다. 인간이 주도권을 잃고 인공 지능에 의해 〈박멸〉되어 가는 디스토피아적 상황, 즉 일자리를 잃고, 노동 계층은 몰락하며, 가짜 뉴스의 범람으로 탈진실화된 사회, 소수의 권력가가 모든 것을 지배하는 독재 체제까지, 극복하기 어려운 위험이 생길 수 있다. 하지만 인공 지능으로 인해서 우리가 얻을 수 있는 유토피아도 존재한다. 지능의 평등이 이루어져 누구나 높은 수준의 지적 능력에 접근할 수 있게 되고, 그동안의 신체, 환경 등 모든 한계를 넘어설 수 있는 초월성을 가지며, 테크노의학으로 질병을 종식시킬 수 있다. 또한 진정한 의미의 민주주의가 실현되며 우리가 상상도 못했던 번영과 이상향을 만들어 줄 것이다.
우리는 간절하게 유토피아를 바라며, 디스토피아가 오길 바라지 않는다. 하지만 어떤 것이 올지 알 수 없기에 혼란스러워하고 있다. 이 책의 저자 로랑 알렉상드르는 바로 이 지점에 대해 우리가 생각하지 못했던 것을 일깨워준다. 미래는 저절로 찾아오는 것이 아니라 우리가 직접 찾아 나아가야 하는 것임을. 유토피아와 디스토피아라는 갈림길에서 우리가 원하는 방향을 〈선택〉해야 한다는 것이다. 

인류의 절반 이상은 GPT-5보다 지능이 떨어질 것이지만,
그럼에도 인류는 영속할 것이다
로랑 알렉상드르는 이 책에서 인공 지능이 교육, 노동, 정치, 권력 등 사회 전반에 걸쳐 초래할 거대한 변화를 심도 있게 탐구한다. 그는 우리가 제대로 대비하지 못했을 때 맞이할 인공 지능의 폐해를 면밀히 분석하며 위험성을 경고하는데, 그가 이것을 얘기하는 이유는 하나다. 인류가 이 모든 위험을 극복할 수 있으며 계속해서 영속해 나아가 더 큰 번영의 길로 나아갈 수 있다는 것을 알리기 위해서이다. 
그는 교육을 강조하며 미래 세대에게 인공 지능을 비판적으로 다루는 법을 가르치는 것이 필수적이라고 말한다. 기술을 통제하는 법을 배우고 인간성을 잃지 않는 법을 익혀서 마침내 인간과 기계 간의 공진화를 이룬다면 새로운 형태의 협력과 발전이 이루어질 것이고 우리의 미래는 찬란한 빛으로 가득할 것이라고 희망의 메시지를 전한다. 
『넥스트 인텔리전스』는 단순히 인공 지능 기술을 논하는 책이 아니라, 인류가 직면할 도전과 선택을 철학적, 사회적으로 제시하는 책이다. 인공 지능은 위협인 동시에 기회이며, 우리의 준비와 선택에 따라 미래는 완전히 달라질 것이다. 매일 쏟아지는 인공 지능 뉴스 속에서 미래에 대한 방향성을 잃었거나 불안을 느끼고 있다면, 바로 이 책이 당신에게 지표가 되어 줄 것이다."
인공지능과 저널리즘(큰글자책),https://search.shopping.naver.com/book/catalog/52423925621,https://shopping-phinf.pstatic.net/main_5242392/52423925621.20250114083254.jpg,심양섭,22500,커뮤니케이션북스,20250120,9791173073366,"생성형 AI가 저널리즘에 미치는 영향과 그에 따른 기회와 위험을 탐구한다. AI는 뉴스 생산의 효율성을 높이고, 콘텐츠 자동화와 데이터 분석을 통해 뉴스룸의 업무 흐름을 개선한다. 아시아, 중동, 라틴 아메리카의 디지털 우선 미디어들은 AI를 빠르게 도입해 혁신을 이끌고 있다. AI 기술이 저널리즘을 어떻게 재편할지에 대한 고민을 제시한다."
인공지능 데이터해석학 (데이터로 인간 읽기),https://search.shopping.naver.com/book/catalog/47934423624,https://shopping-phinf.pstatic.net/main_4793442/47934423624.20240525070942.jpg,강우규^남영자^정유남^조희련,18000,태학사,20240531,9791168102750,"AI와 인간의 정서적 소통을 위해서는, 
인간 중심의 다양한 AI 인문데이터가 필요하다!

인간과 인간의 의사소통이 언어로 이루어진다면, 인간과 AI의 의사소통은 ‘인문데이터’를 통하여 이루어진다. 우리는 컴퓨터 과학이나 자연언어처리를 위하여 숫자로 이루어진 표준 데이터 세트와 구별하기 위해서 인문데이터를 ‘인문학’의 범주로 분류하였다. 

인문데이터는 인공지능 기술 발전이 인간의 가치와 윤리적 기준에 부합하도록 보장하는 기초적인 관점을 제공할 뿐만 아니라, AI가 사회문화적 맥락에 어떠한 영향을 미치는지 조명할 수 있다. 또한 AI 개발에 인간 중심적인 데이터의 속성과 정보를 제공하고, 나아가 AI가 인문학적 주제와 인간 사회에 대한 이해를 돕는 데 기여할 것으로 본다. 이를 통해 기술이 인간과 공감하면서 문화적으로 다양하게 인식되며, 윤리적으로 건전하게 개발될 수 있도록 하는 중추적인 연구 분야로 자리 잡을 것이다. 

앞으로 AI가 감정 능력을 지니며 인간과 정서적으로 소통하기 위해서는 다양한 AI 인문데이터의 구축이 필요하다. 이 책에서 제시한 감정 데이터, 비윤리 데이터 등의 AI 인문데이터는 인간과 AI가 상호작용하기 위해서 인간의 감정, 윤리, 경험의 다면성, 복잡성 등을 고려하여 인간 주석자를 통해 구축되었으며, 한국인의 정서에 적합한 데이터를 구축했다는 점에서 의의가 있다. 

이 책에서는 특히, AI 인문데이터의 구축과 활용의 실제를 살펴보는데, 인간의 마음을 다루는 어휘, 음성, 이미지 형태의 감정 데이터를 중심으로 인간의 복잡한 감정이 AI와 연결되도록 시도하고 있다. 구체적으로 한국어 감정 어휘를 24개의 감정 유형으로 구분하고 사전의 표제어와 용례를 기반으로 감정 어휘 사전을 구축했고, 데이터 설계와 구축 절차를 제공했으며, 딥러닝을 활용한 감성 분석을 제시했다."
인공지능과 살아남을 준비,https://search.shopping.naver.com/book/catalog/50024257618,https://shopping-phinf.pstatic.net/main_5002425/50024257618.20240829071754.jpg,김태권,11700,천개의바람,20240902,9791165735616,"‘딥페이크’로 만든 가짜 이미지를 악용한 범죄가 기승을 부리며, 인공지능은 ‘재앙’이라는 공식이 맞아떨어질까 봐 우리는 불안에 떨고 있다. 챗GPT로 대표되는 ‘생성형 인공지능’은 급속히 발전했고, 이제는 생성형 인공지능으로 글을 쓰거나 그림을 그리는 일이 자연스러워졌다. 가짜 뉴스를 생성하고, 안면 인식 기술로 사람을 감시하는 일이 더욱 쉬워졌다.



인공지능과 함께 도래할 미래 사회는 어떤 모습일까? 수많은 낙관과 비관이 뒤섞여 아무도 미래 사회를 장담하지 못하지만 모두 동의하는 한 가지가 있다. 미래 사회는 지금 우리가 인공지능을 어떻게 잘 활용하고 발전시켜 나가는지에 따라 달라진다는 사실이다. 희망도 절망도 바로 지금 현재에 열쇠가 쥐어져 있다.



이 책은 미래 사회를 이끌어 갈 청소년에게 인공지능 기술을 둘러싼 핵심 쟁점을 짚어주고, 인공지능 기술을 둘러싼 논점이 무엇인지 알려준다. 이 책을 읽으며 청소년이 미래 사회에서 인공지능과 살아남을 준비를 잘 마칠 수 있을 것이다."
AI 트랜스포메이션 (인공지능 도입을 위한 단계별 실전 가이드),https://search.shopping.naver.com/book/catalog/53543010622,https://shopping-phinf.pstatic.net/main_5354301/53543010622.20250315093053.jpg,케이트 리,16920,제이펍,20250328,9791194587057,"AI 대전환은 기업 생존을 위한 필수 선택이다

AI는 이제 단순한 기술이 아니라, 비즈니스의 성패를 좌우하는 핵심 요소다. 혁신을 주도하는 기업들은 AI를 활용해 경쟁 우위를 확보하고 있으며, 이를 제대로 적용하지 못한 기업은 도태될 위험에 처해 있다. 하지만 AI 도입이 곧 성공을 의미하는 것은 아니다. 중요한 것은 ‘어떻게 효과적으로 적용할 것인가’다. 이 책은 막연하게 AI 도입을 외치는 것이 아니라, 현장에서 실행 가능한 전략을 제시한다. 저자가 제안하는 ‘STEP 전략’은 비즈니스 목표에 맞는 AI 도입을 단계적으로 실행할 수 있도록 하며, 기업이 AI를 통해 실질적인 성과를 거둘 수 있도록 설계되었다. 이 책을 통해 AI 트랜스포메이션의 핵심 원칙과 전략을 배우고, 성공적인 미래를 준비하자."
